pmid,source,relation,target,description,missing,source_bucket,target_bucket
36914622,Histone deacetylases,involve in,Zygotic genome activation (ZGA),Histone deacetylases are required for the removal or transition of broad H3K27ac domains and ZGA.,source,,functions
36997626,Deleting the SVA in CDK5RAP2,lead to,neuronal maturation,Deleting the SVA in CDK5RAP2 initiates multi-dimensional neuronal maturation.,source,,functions
36997626,Deleting the SVA in SCN8A,lead to,neuronal maturation,Deleting the SVA in SCN8A initiates selective sodium current neuronal maturation.,source,,functions
36859566,piggyBac-transposon-mediated CAR-T cells,treat,Hematological malignancies,piggyBac-transposon-mediated CAR-T cells are for treating hematological malignancies.,source,,diseases
36859566,piggyBac-transposon-mediated CAR-T cells,treat,solid malignancies,piggyBac-transposon-mediated CAR-T cells are for treating solid malignancies.,source,,diseases
36657637,VGLL4-TEAD1-TET2 axis,involve in,vascular smooth muscle cell differentiation,The VGLL4-TEAD1-TET2 axis is involved in VSMC differentiation.,source,,functions
36657637,VGLL4-TEAD1-TET2 axis,involve in,vascular development,The VGLL4-TEAD1-TET2 axis provides insights into vascular development.,source,,functions
36780344,FV-A2086D mutation,affect,Factor V,The A2086D mutation in the factor V light chain affects its function.,source,,proteins
36780344,FV-W1920R mutation,affect,Factor V,The W1920R mutation in the factor V light chain affects its function.,source,,proteins
36780344,FV-A2086D mutation,lead to,Impaired APC-catalyzed inactivation,The A2086D mutation leads to reduced susceptibility of factor Va to APC and impaired inactivation.,"source,target",,
36780344,FV-A2086D mutation,lead to,Impaired APC cofactor activity,The A2086D mutation leads to impaired APC cofactor activity of factor V.,"source,target",,
36780344,FV-A2086D mutation,lead to,Weakened interaction with phospholipid membranes,The A2086D mutation leads to a weakened interaction between factor Va and phospholipid membranes.,"source,target",,
36780344,FV-A2086D mutation,lead to,Failure to inhibit tissue factor-induced thrombin generation,The A2086D mutation leads to failure of factor Va to inhibit tissue factor-induced thrombin generation.,"source,target",,
36780344,FV-A2086D mutation,cause,Deep vein thrombosis,The A2086D mutation in factor V is associated with deep vein thrombosis.,source,,diseases
36780344,FV-W1920R mutation,cause,Deep vein thrombosis,The W1920R mutation in factor V is associated with deep vein thrombosis.,source,,diseases
36780344,Impaired factor V-related anticoagulant mechanisms,associate with,Congenital thrombophilia,Defects in factor V anticoagulant mechanisms are consistent with congenital thrombophilia.,source,,diseases
36537219,Transposase N-terminal phosphorylation,inhibit,piggyBac transposition,Transposase N-terminal phosphorylation negatively regulates piggyBac transposition in mammalian cells.,source,,functions
36537219,Asymmetric transposon ends,inhibit,piggyBac transposition,The requirement for asymmetric transposon ends negatively regulates piggyBac transposition in mammalian cells.,source,,functions
36497059,LINE-1,express,RNA,LINE-1 RNA expression levels are quantified and found to be increased in senescent cells.,target,transposons,
36497059,Alu,express,RNA,Alu RNA expression levels are quantified and found to be increased in senescent cells.,target,transposons,
36418540,SVA insertion,associate with,X-linked dystonia parkinsonism,The insertion mutation is associated with the underlying cause of XDP.,source,,diseases
36460901,retrotransposon expression,lead to,DNA double-strand breaks,Retrotransposon expression can lead to DNA double-strand breaks.,source,,functions
36460901,retrotransposon expression,stimulate,cellular innate immunity stimulation,Retrotransposon expression can stimulate cellular innate immunity.,source,,functions
36460901,retrotransposon biology,associate with,post-transcriptional RNA metabolism,Retrotransposon biology intertwines with general post-transcriptional RNA metabolism.,source,,functions
36460901,post-transcriptional factors,involve in,retrotransposon biology,Post-transcriptional factors are involved in the biology of retrotransposons.,"source,target",,
36460901,retrotransposon RNP sequestration in cytoplasmic bodies,affect,retrotransposon biology,The effects of retrotransposon RNP sequestration in cytoplasmic bodies are discussed.,"source,target",,
36460901,autophagy,affect,retrotransposon biology,The effects of autophagy on retrotransposon biology are discussed.,target,functions,
36460901,innate immunity restriction of retrotransposons,suppress,retrotransposon activity,Innate immunity restricts retrotransposons.,target,functions,
36460901,retrotransposons,utilize,utilization of cellular enzymes for replication,"Retrotransposons make use of cellular enzymes, including DNA repair machinery, to complete their replication cycles.",source,,functions
36420574,AluYa5 insertion in NKX2-1,cause,NKX2-1-related disorder,The de novo AluYa5 insertion in NKX2-1 caused NKX2-1-related disorder in the proband.,source,,diseases
36420574,AluYa5 insertion in NKX2-1,lead to,Haploinsufficiency,Functional studies explored NKX2-1 haploinsufficiency caused by the Alu insertion.,source,,functions
36420574,AluYa5 insertion in NKX2-1,affect,NKX2-1 mRNA,Functional studies at the RNA level were performed to assess the impact of the insertion.,source,,rnas
36420574,AluYa5 insertion in NKX2-1,affect,NKX2-1 protein,Functional studies at the protein level were performed to assess the impact of the insertion.,source,,proteins
36420574,NKX2-1 haploinsufficiency,lead to,NKX2-1-related disorder,Heterozygous NKX2-1 loss-of-function variants cause the disorder.,source,,diseases
36219870,LTR5_Hs,create,species-specific H3K4me3 regions,Species-specific insertions of LTR5_Hs retrotransposons created species-specific H3K4me3 regions.,target,transposons,
36219870,species-specific H3K4me3 regions,associate with,increased expression of nearby genes,Species-specific H3K4me3 regions were associated with increased expression of nearby genes.,"source,target",,
36219870,POU5F1,bind,species-specific H3K4me3 regions,Gains in binding motifs for POU5F1 were found in species-specific H3K4me3 regions.,target,genes,
36219870,SOX2,bind,species-specific H3K4me3 regions,Gains in binding motifs for SOX2 were found in species-specific H3K4me3 regions.,target,genes,
36215696,centSIRT6,suppress,LINE-1,The centenarian variant centSIRT6 is a stronger suppressor of LINE-1 retrotransposons than wild-type.,source,,transposons
36215696,centSIRT6,stimulate,DNA double-strand break repair,centSIRT6 confers enhanced stimulation of DNA double-strand break repair.,source,,functions
36215696,centSIRT6,interact with,Lamin A/C,centSIRT6 displays a stronger interaction with Lamin A/C (LMNA).,source,,proteins
36215696,centSIRT6,modify,Lamin A/C,Enhanced interaction with LMNA is correlated with enhanced ribosylation of LMNA by centSIRT6.,source,,proteins
36192170,AP-1 binding motif,drive,Enhancer activity,AP-1-related binding motifs were identified as drivers of LTR18A enhancer activity.,source,,functions
36192170,CEBP binding motif,drive,Enhancer activity,CEBP-related binding motifs were identified as drivers of LTR18A enhancer activity.,source,,functions
36143463,LINE-1,disrupt,genes,LINE-1 transposition disrupts genes in the genome of patients with brain disorders.,target,transposons,
36010599,Repetitive sequences,associate with,Genome instability,Altered activity of repetitive sequences can lead to genome instability.,source,,functions
36010599,Repetitive sequences,participate in,Epigenetic regulation,Repetitive sequences play a role in epigenetic regulation.,source,,functions
36010599,Repetitive sequences,associate with,Cancer transformation,Repetitive sequences can contribute to cancer transformation.,source,,functions
35970867,LINE-1,cause,Genome instability,LINE-1 retrotransposition can cause genome instability.,target,transposons,
35970867,LINE-1,drive,Genetic variation,LINE-1 retrotransposition can cause genetic variation.,target,transposons,
35970867,NEXMIF loss,affect,LINE-1,Nexmif knockout mice exhibited upregulated LINE-1 element expression.,source,,transposons
35970867,NEXMIF loss,lead to,Phenotypic variability,Loss of Nexmif results in the expression of phenotypic variability.,"source,target",,
35970867,NEXMIF loss,lead to,Loss of genomic integrity,Loss of Nexmif results in loss of genomic integrity.,"source,target",,
35871298,coiled coil domain of ORF1p,affect,formation of tightly compacted nucleic acid-bound complex,The coiled coil domain governs the ability of nucleic acid-bound ORF1p trimers to form tightly compacted complexes.,source,,functions
35871298,coiled coil domain of ORF1p,affect,retrotransposition,"Coiled coil mutants (151p, m15p) that fail to form compacted complexes are retrotransposition-null.",source,,functions
35864085,Alu,suppress,P53 expression,Intronic Alus have a suppressive role in P53 expression.,target,transposons,
35864085,intron removal,affect,transcriptional activity,Removal of introns demonstrates that intron requirements for transcriptional activities vary among genes.,source,,functions
35868859,SVA insertion in TAF1,cause,X-linked Dystonia-Parkinsonism,"XDP is possibly due, in part, to a partial loss of TAF1 function caused by the SVA insertion.",source,,diseases
35859320,SVA insertion in GNAS,cause,Pseudohypoparathyroidism type 1B,Retrotransposon insertion likely caused decreased NESP55 expression leading to PHP1B development.,source,,diseases
35768521,SVA insertion in SRCAP,cause,Neurodevelopmental diseases,The SVA insertion causes a neurodevelopmental disorder in the proband.,source,,diseases
35768521,SVA insertion in SRCAP,affect,SRCAP transcript,The SVA insertion leads to significant depletion of SRCAP expression and low-level exon skipping.,source,,rnas
35691110,SVA insertion in SOX10,cause,Waardenburg syndrome,A patient with Waardenburg syndrome carries a heterozygous SVA-F retrotransposon insertion into SOX10.,source,,diseases
35691110,SOX10 mutation,associate with,migrating neural crest cells,Mutations of SOX10 can be found in association with a defect of migrating neural crest cells.,source,,functions
35691110,SOX10 mutation,cause,Waardenburg syndrome,Mutations of SOX10 result in Waardenburg syndrome.,source,,diseases
35732404,Transposable elements (TEs),participate in,gene regulatory network evolution,TEs contribute to the evolution of gene regulatory networks.,source,,functions
35732404,Transposable elements (TEs),affect,post-transcriptional control,TEs influence the miRNA system of post-transcriptional control.,source,,functions
35732404,Transposable elements (TEs),express,TE-embedded miRNA,TEs are dynamically expressed and give rise to TE-embedded miRNAs.,source,,rnas
35741345,Alu insertion in promoter,participate in,Alternative promoter,An Alu insertion in the promoter region may play a role in alternative promoter usage.,source,,functions
35741345,LINE-1 element in 3'UTR,participate in,Alternative transcriptional termination,An LINE-1 element in the 3'UTR may play a role in alternative transcriptional termination.,source,,functions
35741345,Intronic Alus,affect,Alternative splicing,Several intronic Alus may influence alternative splicing.,source,,functions
35741345,Intronic Alus,mediate,RNA circularization,Intronic Alus may influence alternative splicing via RNA circularization.,source,,functions
35741345,Alus,participate in,Recombination,Alus present throughout the genes are prone to recombination events.,source,,functions
35741345,Recombination of Alus,lead to,Spinal muscular atrophy,"Recombination events could lead to SMN1 exons deletions and, ultimately, SMA.",source,,diseases
35704668,SVA,regulate,gene expression,SVAs modulate human gene expression.,target,transposons,
35609796,Transposable elements,drive,Genome evolution,Transposable elements are a major source of genetic variation that drives genome evolution.,source,,functions
35342861,Lamins,interact with,Histone deacetylases,Lamins interact with histone deacetylases.,target,proteins,
35342861,LINE-1,localize to,Heterochromatin domains,LINE-1 is present in the heterochromatin domains of the genome associated with lamins.,target,transposons,
35342861,Transposable elements,associate with,Aging,Transposable elements are secondary messengers of environmental stressors that can serve as triggers for aging.,source,,functions
35342861,Transposable elements,associate with,Carcinogenesis,Transposable elements are secondary messengers of environmental stressors that can serve as triggers for carcinogenesis.,source,,functions
35342861,Transposons,involve in,Cancer,Transposons play a role in the development of cancer.,source,,diseases
34675070,MLT2A1,express,RNA,MLT2A1 is expressed in human four-cell and eight-cell embryos and in some adult somatic tissues.,target,transposons,
34675070,MLT2A2,express,RNA,MLT2A2 is expressed in human four-cell and eight-cell embryos and in some adult somatic tissues.,target,transposons,
34587152,Tau protein isoforms,associate with,Cell death,Different tau isoforms show differences in rates of cell death.,source,,functions
34587152,Tau protein isoforms,associate with,Transposable element dysregulation,Tau isoform overexpression results in isoform-specific transposable element dysregulation.,source,,functions
34587152,Amyloid-beta oligomers,interact with,Tau protein isoforms,Tau isoforms interact with amyloid-beta in SH-SY5Y cells.,target,proteins,
34400477,Transposable elements,participate in,transcriptional innovation,TEs are drivers of transcriptional innovation in the developing human brain.,source,,functions
34400477,Transposable elements,drive,genome innovation,TEs mediate genome innovation.,source,,functions
34400477,Transposable elements,involve in,brain development,TE-mediated genome innovation is important for neurotypical human brain development.,source,,functions
34400477,KZFPs,regulate,Transposable elements,KZFPs are TE controllers that fine-tune gene expression networks.,target,proteins,
34400477,Transposable elements,activate,neurogenesis-associated genes,TE-derived alternative promoters drive the expression of neurogenesis-associated genes.,"source,target",,
34390351,TE sequences,associate with,RNA Binding Proteins,The presence of TE sequences within a transcript correlates with differential association with RBPs.,source,,proteins
34390351,TE sequences,affect,Transcript modulation,Incorporation of TE sequences has consequences for transcript structure and function.,source,,functions
34390351,TE sequences in mRNAs,lead to,Peptide generation,TE sequences incorporated into mRNAs generate TE sequence-derived peptides.,source,,functions
34231212,SVA-E insertion in SMARCB1,disrupt,Correct splicing,The SVA-E insertion disrupts correct splicing of the SMARCB1 gene.,source,,functions
34231212,SVA-E insertion in SMARCB1,cause,Atypical teratoid/rhabdoid tumor,"The SVA-E insertion disrupts SMARCB1, resulting in loss of a functional allele and causing ATRT.",source,,diseases
34253898,Chemotherapy,induce,Haematopoietic regeneration,Chemotherapy induces haematopoietic regeneration.,source,,functions
34253898,Chemotherapy,associate with,Increased transcription of transposable elements,Chemotherapy is associated with increased transcription of transposable elements during early recovery.,"source,target",,
34253898,ERV,overexpression,HSC cycling,Overexpression of ERV superfamily TE copies results in haematopoietic stem cell cycling.,target,transposons,
34253898,LINE,overexpression,HSC cycling,Overexpression of LINE superfamily TE copies results in haematopoietic stem cell cycling.,target,transposons,
34253898,LINE-1,knockdown,HSC quiescence,Knockdown of LINE-1 copies causes haematopoietic stem cells to retain their quiescence.,target,transposons,
34253898,MDA5,lack,Impaired inflammatory response,Haematopoietic stem cells that lack MDA5 exhibit an impaired inflammatory response after chemotherapy.,target,proteins,
34253898,MDA5,lack,Retained quiescence,Haematopoietic stem cells that lack MDA5 retain their quiescence after chemotherapy.,target,proteins,
34183725,AluY insertion in RP1,cause,Macular dystrophy,The AluY insertion in RP1 exon 4 was detected in patients with macular dystrophy.,source,,diseases
34183725,AluY insertion in RP1,associate with,Inherited retinal disease,"The AluY insertion was identified in Korean patients with inherited eye diseases, including specific retinal phenotypes.",source,,diseases
34158539,MAP2K4 translocation,cause,Breast cancer,The translocation interrupting MAP2K4 is potentially a driver mutation in breast cancer.,source,,diseases
34174884,Repeat to gene expression ratios,correlate with,hematopoietic differentiation,Changes in repeat to gene expression (R/G ratios) correlate with hematopoietic differentiation.,source,,functions
34174884,Repeat to gene expression ratios,associate with,Acute myeloid leukemia,Relative changes in repeat to gene expression can stratify risk prediction of AML patients and correlate with overall survival probabilities.,source,,diseases
34113336,P53 mutation,associate with,Triple-hit lymphoma,P53 mutation is an independently poor prognostic indicator in patients with triple-hit lymphoma.,source,,diseases
34113336,CAR19-T cell therapy,treat,Triple-hit lymphoma,CAR19-T cell therapy was used to treat a patient with triple-hit refractory/relapsed DLBCL.,source,,diseases
34113336,CAR19-T cell therapy,induce,Cytokine release syndrome,CAR19-T cell therapy induced grade 2 cytokine release syndrome in the patient.,source,,diseases
34113336,PiggyBac-generated CAR19-T cells,associate with,Complete remission,PiggyBac-generated CAR19-T cell therapy was associated with sustained complete remission in a patient with triple-hit lymphoma.,"source,target",,
34071585,AluY,express,RNA,"AluY-retrotransposons reemerge following H-1PV treatment, indicating expression.",target,transposons,
34010392,piggyBac,utilize,CD19 CAR T cells,piggyBac transposon was used to modify CD19 CAR T cells.,target,transposons,
34010392,piggyBac-modified CD19 CAR T cells,associate with,CAR T-cell lymphoma,Treatment with piggyBac-modified CD19 CAR T cells was associated with development of CAR T-cell lymphoma.,source,,diseases
34083437,RHOXF2 mutants,cause,Infertility,Loss-of-function mutants of RHOXF2 from infertile patients may cause infertility by allowing uncontrolled LINE-1 expression.,source,,diseases
34083437,RHOX10,suppress,LINE-1 transposition,RHOX10 suppresses LINE-1 transposition during fetal germline development.,target,proteins,
34083437,RHOXF2 mutants,affect,LINE-1,"RHOXF2 mutants lose the ability to suppress LINE-1, potentially allowing its uncontrolled expression.",source,,transposons
33992534,MPP8 deficiency,suppress,Acute myeloid leukemia,MPP8 deficiency impedes tumor development in AML.,source,,diseases
33983939,ADAR1 editing,suppress,dsRNA-dependent response,"Editing by ADAR1 ends further interaction with MDA5, terminating innate immune responses against self.",source,,functions
33972655,CAG repeat expansion in PPP2R2B,cause,Spinocerebellar ataxia type 12,CAG repeat expansion beyond 43 triplets in PPP2R2B causes spinocerebellar ataxia type 12.,source,,diseases
33972655,Cas9 nickase,cleave,DNA,Cas9 nickase cleaves DNA to generate single-stranded breaks for editing.,target,proteins,
33972655,BCL-XL,enhance,Cell survival,Transient overexpression of BCL-XL enhances cell survival after electroporation.,target,proteins,
33989302,PiggyBac,insert into,genome,The PiggyBac transposon vector inserts a sequence encoding part of mKG into the genome.,target,transposons,
33896072,AluY insertion in SMARCB1,cause,Atypical teratoid/rhabdoid tumor,"The AluY insertion in SMARCB1 caused a frameshift truncation, leading to loss of protein expression and AT/RT.",source,,diseases
33896072,SMARCB1 mutation,lead to,Copy-number neutral loss of heterozygosity,"Biallelic SMARCB1 mutations, including copy-number neutral LOH, are characteristic of AT/RT.",source,,functions
33896072,SMARCB1 mutation,cause,Atypical teratoid/rhabdoid tumor,Biallelic SMARCB1 mutations represent the characteristic genetic lesion in AT/RT.,source,,diseases
33896072,SMARCB1 mutation,associate with,Rhabdoid tumor predisposition syndrome 1,Germline SMARCB1 alterations are associated with rhabdoid tumor predisposition syndrome 1.,source,,diseases
33826137,De novo somatic retrotransposition in KCNIP4,affect,KCNIP4 mRNA,ddPCR results suggest the de novo LINE-1 did not alter KCNIP4 mRNA expression.,source,,rnas
33751828,HIF1α-VEGFA-mediated angiogenesis,lead to,Metastatic colonization,"This angiogenesis enhances colonization, the last step of metastasis.",source,,functions
33751828,NFIB/ERO1A/VEGFA pathway,correlate with,Breast cancer,High expression of this pathway correlates with reduced breast cancer patient survival.,source,,diseases
33722937,ZNF91 deletion,affect,SVA,CRISPR-Cas9-mediated deletion of ZNF91 leads to loss of SVA repression and activation.,source,,transposons
33722937,ZNF611 deletion,affect,SVA,SVA activation was not observed upon genetic deletion of ZNF611.,source,,transposons
33684176,piggyBac,utilize,Gene deletion of JMJD6,piggyBac transposon was used to mediate gene deletion of JMJD6 in mice.,target,transposons,
33693705,DUX4 misexpression,cause,Facioscapulohumeral muscular dystrophy,Misexpression of DUX4 causes FSHD.,source,,diseases
33672287,KRAB-ZFPs,bind,DNA,KRAB-ZFPs bind to specific DNA sequences via zinc finger motifs.,target,proteins,
33659249,MER20/MER39 expression cassette,utilize,Endometrial receptivity maintenance,The genetic tool uses the MER20/MER39 cassette to predict appropriate hormonal therapy for receptivity maintenance.,source,,functions
33659249,PRL promoter,contain,MER20,The decidual prolactin promoter contains the ancient transposon MER20.,source,,transposons
33659249,PRL promoter,contain,MER39,The decidual prolactin promoter contains the ancient transposon MER39.,source,,transposons
33616891,HRV16 infection,reduce,piRNA,Rhinovirus infection reduces the expression of some piRNAs.,source,,rnas
33616891,HRV16 infection,promote,LINE-1,Reduced piRNA expression facilitates upregulation of LINE-1 transcription.,source,,transposons
33616891,HRV16 infection,promote,retrotransposons,Reduced piRNA expression facilitates upregulation of retrotransposons' expression.,"source,target",,
33526699,Alu cDNA,mediate,Retinal pigmented epithelium degeneration,Alu RNA-induced RPE degeneration is mediated via cytoplasmic LINE-1-reverse-transcribed Alu cDNA.,target,rnas,
33526699,Cytoplasmic reverse transcription,lead to,Retinal pigmented epithelium degeneration,Cytoplasmic Alu cDNA synthesis mediates RPE degeneration independently of retrotransposition.,target,functions,
33445593,Transposon-derived nucleic acids,trigger,Autoinflammatory disorders,Enhanced expression of transposon-derived nucleic acids can trigger autoimmune reactions that may result in severe autoinflammatory disorders.,source,,diseases
33445593,Pattern recognition receptors,involve in,Nucleic acid sensing,The review describes the role of known pattern recognition receptors in nucleic acid sensing of LINE-1 and Alu.,source,,functions
33432196,LINE-1 insertion in CNNM2,affect,CNNM2,The LINE-1 insertion significantly reduced CNNM2 gene expression.,source,,genes
33432196,LINE-1 insertion in FRMD4A,affect,FRMD4A,The LINE-1 insertion significantly reduced FRMD4A gene expression.,source,,genes
33315879,SVA insertion,induce,aberrant splicing,SVA insertion induces aberrant TAF1 splicing.,source,,functions
33315879,SVA insertion,induce,intron retention,SVA insertion induces partial intron retention.,source,,functions
33315879,aberrant splicing and intron retention,lead to,gene expression dysregulation,Altered transcriptional dynamics decrease full-length TAF1 transcript.,source,,functions
33293698,SVA insertion in MSH6/MSH2,cause,Aberrant RNA splicing,SVA insertions induced aberrant splicing.,source,,functions
33293698,SVA insertion in MSH6/MSH2,cause,Lynch syndrome,SVA insertions in MMR genes cause Lynch syndrome.,source,,diseases
33186547,LINE-1,express,Aberrant expression,Demethylation of aberrantly expressed young LINE-1s in normal tissues.,target,transposons,
33060137,P53 mutation,affect,LINE-1,Elimination of p53 prompts LINE1s to become hyperactive.,source,,transposons
33060137,LINE-1 hyperactivity,lead to,Cancer,Erupting LINE1s produced acute oncogenic threats when p53 was absent.,source,,diseases
33058565,AluSx insertion in MLH1,cause,Lynch syndrome,The insertion of an AluSx-like element into MLH1 intron 7 causes Lynch syndrome.,source,,diseases
33058565,AluSx insertion in MLH1,lead to,mRNA splicing,The AluSx-like element leads to complete disruption of mRNA splicing.,source,,functions
33058565,AluSx insertion in MLH1,lead to,Transcriptional termination,The insertion probably results in transcriptional termination at the poly(A) region of the AluSx-like element.,source,,functions
33058565,AluSx insertion in MLH1,affect,MLH1,The insertion results in aberrant splicing and transcription of MLH1.,source,,genes
33058565,MLH1 mutation,associate with,Lynch syndrome,Germline mutations in MLH1 account for ~40% of Lynch syndrome-related alterations.,source,,diseases
33032882,hAD-MSCs.TSP-1,treat,lung metastatic melanoma,hAD-MSCs expressing TSP-1 are assessed for therapeutic potential in lung metastatic melanoma.,source,,diseases
32965162,C > T mutation,affect,Alu,A C > T mutation optimizes the 5' splice site in an AluJ/LTR78 composite exon.,source,,transposons
32965162,C > T mutation,lead to,aberrant splice-site activation,"The mutation disrupts a conserved AluJ stem, liberating a primordial GC 5' splice site for spliceosome interaction.",source,,functions
