pmid,source,relation,target,description,missing,source_bucket,target_bucket
23053642,High nuclear ORF1p expression,associate with,Invasive breast cancer,High nuclear expression of ORF1p is associated with the worst patient survival in invasive breast cancer.,source,,diseases
23053642,High nuclear ORF2p expression,associate with,Invasive breast cancer,High nuclear expression of ORF2p is associated with the worst patient survival in invasive breast cancer.,source,,diseases
10980575,LINE-1 insertion in CYBB,cause,Chronic granulomatous disease,The LINE-1 insertion into CYBB caused severe chronic granulomatous disease in the patient.,source,,diseases
10980575,LINE-1 insertion in CYBB,lead to,alternative splicing,"The insertion introduced new splice sites, resulting in a highly heterogeneous splicing pattern.",source,,functions
10980575,LINE-1 insertion in CYBB,involve in,insertional mutagenesis,The insertion of the LINE-1 element illustrates a new mechanism by which these elements can modify the transcribed coding sequence of genes.,source,,functions
15190191,Insertional mutagenesis,lead to,Disease,Insertional mutagenesis can cause disease.,target,functions,
17028956,Ta-LINE-1 insertion,correlate with,hnRNA,Some Ta-LINE-1 insertions correlate with decreased content of the corresponding hnRNAs.,source,,rnas
12827496,LINE-1 insertion in CHM,cause,Choroideremia,The LINE-1 insertion is a causative mutation for choroideremia.,source,,diseases
12827496,Intronic mutation in CHM,cause,Choroideremia,"An intronic mutation creates a strong acceptor splice site and leads to inclusion of a cryptic exon, causing choroideremia.",source,,diseases
18615094,LINE-1 insertion in IL23R,create,IL-23 receptor-alpha chain transcript,The LINE-1 insertion creates a novel exon insertion variant (exon 9a) in the IL-23 receptor transcript.,source,,rnas
18615094,LINE-1 insertion in IL23R,lead to,Alternative splicing,"The insertion leads to an alternative splicing event, creating a novel exon insertion variant.",source,,functions
17273961,SVA insertion in TAF1,associate with,X-linked Dystonia-Parkinsonism,The SVA insertion is associated with XDP.,source,,diseases
17273961,SVA insertion in TAF1,affect,TAF1,The SVA insertion is associated with significantly decreased expression of TAF1.,source,,genes
17273961,SVA insertion in TAF1,affect,DRD2,The SVA insertion is associated with significantly decreased expression of DRD2.,source,,genes
17273961,DNA methylation in SVA,lead to,Decreased TAF1 expression,Abnormal DNA methylation in the retrotransposon could account for decreased expression of TAF1.,"source,target",,
17273961,Reduced TAF1 expression,associate with,X-linked Dystonia-Parkinsonism,Reduced neuron-specific expression of the TAF1 gene is associated with XDP.,source,,diseases
12083952,common chemotherapeutic drugs,induce,SINE transcription,Exposure to chemotherapeutic drugs induces SINE transcription.,target,pharmaceuticals,
12083952,gamma-radiation,induce,SINE transcription,Exposure to gamma-radiation induces SINE transcription.,target,toxins,
20602999,LINE-1,insert into,Gene,"LINE-1 retrotransposons can insert into genes, creating insertional polymorphisms.",target,transposons,
20602999,Alu,insert into,Gene,Alu SINEs are other insertions that can be mapped to expand the catalog of genomic variants.,target,transposons,
21034368,SVA insertion in TAF1,cause,X-linked Dystonia-Parkinsonism,SVA insertion in TAF1 is associated with XDP.,source,,diseases
21034368,SVA insertion in TAF1,inhibit,Neuron-specific expression,SVA insertion may reduce neuron-specific expression of the TAF1 isoform.,source,,functions
21034368,SVA insertion in TAF1,inhibit,Transcription,"SVA insertion may interfere with the transcription of many neuronal genes, including DRD2.",source,,functions
17623810,PIPSL protein,bind,Ubiquitinated proteins,The PIPSL protein has significant affinity for cellular ubiquitinated proteins via its PSMD4-derived motifs.,target,proteins,
21573203,LTR insertion,cause,Transcriptional disruption,LTR element insertions cause transcriptional disruption.,source,,functions
22547343,Ionising irradiation,activate,LINE-1,Ionising irradiation activates mobile elements like retrotransposons.,source,,transposons
22547343,Ionising irradiation,increase,transcription,X-rays and carbon-ion beams increased frequencies of transcription from LINE-1.,source,,functions
22547343,Ionising irradiation,increase,retrotransposition,X-rays and carbon-ion beams increased frequencies of LINE-1 retrotransposition.,source,,functions
22547343,LINE-1,express,RNA,LINE-1 retrotransposons are transcribed into RNA.,target,transposons,
22547343,LINE-1 retrotransposition,lead to,insertional mutation,"De novo LINE-1 insertions are induced by irradiation, causing mutations.",source,,functions
21878902,piggyBac,utilize,genetic modification,The piggyBac transposon is used to modify T cells.,target,transposons,
21878902,CAR.CD19-28ζ,direct,T cells,The CAR.CD19-28ζ gene directs T cells to B lymphomas.,target,genes,
21878902,Rapamycin,inhibit,effector T cells,Rapamycin directly inhibits effector T cells.,target,pharmaceuticals,
21878902,Combination therapy,produce,antitumor activity,The combination of rapamycin and rapa-resistant CAR.CD19-28ζ T cells produces greater antitumor activity.,"source,target",,
21878902,Combination therapy,treat,Burkitt's lymphoma,The combination therapy shows antitumor activity against Burkitt's lymphoma cell LINE.,source,,diseases
21878902,Combination therapy,treat,pre-B ALL,The combination therapy shows antitumor activity against pre-B ALL cell LINE.,source,,diseases
23734298,LINE-1 retrotransposition,cause,deleterious effects on the host-cell,LINE-1 retrotransposition can cause deleterious effects on the host-cell.,target,functions,
23151517,piggyBac,utilize,gene therapy,The piggyBac transposon plasmid was used as a vector for TB4 gene delivery.,target,transposons,
23151517,TB4 gene therapy,increase,NKX2.5 mRNA,NKX2.5 mRNA was 24-fold higher than in control groups after TB4 gene therapy.,source,,rnas
23665280,LINE-1 insertion in MCC,abolish,MCC,MCC expression was ablated by LINE-1 insertion.,source,,genes
23665280,MCC ablation,lead to,Oncogenic β-catenin/Wnt signaling,Ablation of MCC expression enabled oncogenic β-catenin/Wnt signaling.,source,,functions
23665280,LINE-1 insertion in ST18,activate,ST18,ST18 was activated by a tumor-specific LINE-1 insertion.,source,,genes
23665280,LINE-1 insertion in ST18,disrupt,Negative feedback loop,The LINE-1 interrupted a negative feedback loop by blocking ST18 repression of its enhancer.,source,,functions
22513051,dystrophin mutation,cause,Duchenne muscular dystrophy,X-linked mutation of dystrophin is related to DMD.,source,,diseases
22513051,dystrophin mutation,cause,Becker muscular dystrophy,X-linked mutation of dystrophin is related to BMD.,source,,diseases
22513051,dystrophin mutation,lead to,cardiac degeneration,Cardiac degeneration in dystrophinopathies may account for progenitor exhaustion.,"source,target",,
22513051,cardiac progenitor cells,participate in,cardiomyogenesis,CPCs contribute to cardiomyogenesis in xenotransplantation experiments.,source,,functions
22513051,cardiac progenitor cells,participate in,cardiac differentiation,CPCs were investigated for their ability to differentiate into myocardial cell types.,source,,functions
22513051,cardiac progenitor cells,participate in,self-renewal,CPCs possess self-renewal capability.,source,,functions
22513051,cardiac progenitor cells,participate in,xenotransplantation,CPCs were used in xenotransplantation experiments in mice.,source,,functions
22513051,cardiac progenitor cells,associate with,Cardiomyopathy,CPCs were tested for cell therapy feasibility for cardiomyopathies.,source,,diseases
22513051,cardiac progenitor cells,associate with,Duchenne muscular dystrophy,CPCs were isolated from a preclinical model (GRMD) of DMD.,source,,diseases
23928856,HBB mutation,cause,Sickle cell disease,A single mutation in the HBB gene causes sickle cell disease.,source,,diseases
24371271,RNase L gene,encode,RNase L,The RNase L gene encodes the RNase L protein.,source,,proteins
25043885,LINE-1,disrupt,Gene,De novo LINE-1 insertions can disrupt target loci (genes) at their new location.,target,transposons,
25043885,LINE-1 retrotransposition,lead to,insertional mutagenesis,LINE-1 retrotransposition accounts for polymorphic variation and disruption of target loci.,source,,functions
25010268,SAMHD1,bind,RNA,SAMHD1 protein binds RNA.,target,proteins,
25010268,SAMHD1,localize to,nuclear compartment,SAMHD1 protein localizes to the nuclear compartment.,target,proteins,
24337508,reverse transcriptase inhibition,promote,cellular differentiation,Inhibition of LINE-1-encoded reverse transcriptase promotes differentiation of breast cancer cells.,source,,functions
24337508,reverse transcriptase inhibition,suppress,proliferation,Inhibition of reverse transcriptase represses genes involved in proliferation.,source,,functions
24337508,reverse transcriptase inhibition,suppress,cell migration,Inhibition of reverse transcriptase represses genes involved in cell migration.,source,,functions
24337508,reverse transcriptase inhibition,suppress,invasive activity,Inhibition of reverse transcriptase represses genes involved in invasive activity.,source,,functions
24337508,reverse transcriptase inhibition,promote,cell projection formation,Inhibition of reverse transcriptase upregulates genes involved in cell projection formation.,source,,functions
24337508,reverse transcriptase inhibition,promote,formation of vacuolar membranes,Inhibition of reverse transcriptase upregulates genes involved in formation of vacuolar membranes.,source,,functions
24337508,reverse transcriptase inhibition,promote,cell-to-cell junction formation,Inhibition of reverse transcriptase upregulates genes involved in cell-to-cell junction formation.,source,,functions
24505276,D125N in PTPRQ protein,affect,PTPRQ protein,"The D125N variant is a somatic, damaging single nucleotide variant in the PTPRQ protein.",source,,proteins
2536938,Lipoprotein lipase,catalyze,Triacylglycerol metabolism,Lipoprotein lipase catalyzes triacylglycerol metabolism.,target,proteins,
25745018,Templated sequence insertion polymorphism (TSIP),associate with,Genetic disease,TSIPs may be important for the generation of human diversity and genetic diseases.,source,,diseases
25745018,Templated sequence insertion polymorphism (TSIP),lead to,Insertional mutagenesis,TSIPs represent a form of polymorphic insertions that can cause insertional mutations.,source,,functions
25716322,IFNAR1 knockdown,affect,LINE-1 propagation,Knockdown of IFNAR1 stimulated LINE-1 propagation in vitro.,source,,functions
25716322,IFNAR1 deficiency,affect,LINE-1,Greater accumulation of LINE-1 was found in mice lacking IFNAR1.,source,,transposons
25782871,LINE-1 hypomethylation,associate with,Epigenetic field defect,LINE-1 hypomethylation in noncancerous gastric mucosae suggests the formation of an epigenetic field defect.,source,,functions
25782871,Helicobacter pylori infection,correlate with,LINE-1 hypomethylation,LINE-1 hypomethylation of noncancerous gastric mucosae significantly correlated with H. pylori infection.,"source,target",,
25791297,GTSF1 deletion,cause,Infertility,Deletion of GTSF1 causes male-specific sterility.,source,,diseases
25791297,GTSF1 deletion,lead to,LINE-1 derepression,Deletion of GTSF1 causes derepression of LINE-1 retrotransposons.,"source,target",,
25791297,Piwi pathway alteration,lead to,defective spermatogenesis,Loss-of-function mutations in the Piwi pathway lead to defective spermatogenesis.,source,,functions
25791297,Piwi pathway alteration,induce,LINE-1 derepression,Piwi-pathway alteration induces LINE-1 transposon derepression.,"source,target",,
25791297,Piwi pathway alteration,associate with,Infertility,Infertility in cryptorchidism is a consequence of alterations in the Piwi pathway.,source,,diseases
26448926,LINE-1 methylation status,associate with,Cancer,LINE-1 methylation status can be utilized as a clinical biomarker for disease stage and disease-free survival in cancer patients.,source,,diseases
26134849,SAMHD1,affect,eIF4A/eIF4G interaction,SAMHD1 activity correlates with diminished eIF4A/eIF4G interaction.,target,proteins,
26134849,G3BP1 depletion,affect,stress granule assembly,Depletion of G3BP1 abrogates stress granule formation.,source,,functions
26134849,TIA1 depletion,affect,stress granule assembly,Depletion of TIA1 abrogates stress granule formation.,source,,functions
26134849,G3BP1 depletion,affect,SAMHD1 inhibition of LINE-1,Depletion of G3BP1 overcomes SAMHD1 inhibition of LINE-1.,"source,target",,
26134849,TIA1 depletion,affect,SAMHD1 inhibition of LINE-1,Depletion of TIA1 overcomes SAMHD1 inhibition of LINE-1.,"source,target",,
26156589,HBB IVS2-654 (C > T) mutation,cause,β-thalassemia,The point mutation in the HBB gene causes β-thalassemia.,source,,diseases
26156589,TALENs-corrected iPSC clones,participate in,Erythroblast differentiation,TALENs-corrected iPSC clones were selected for erythroblast differentiation using the OP9 co-culture system.,source,,functions
26156589,TALENs-corrected iPSC clones,regulate,HBB,TALENs-corrected iPSC clones showed relatively higher transcription of HBB than uncorrected cells after erythroblast differentiation.,source,,genes
26496357,Poc1a disruption,cause,Male infertility,Poc1a disruption causes male infertility.,source,,diseases
26496357,Poc1a disruption,cause,Skeletal dysplasia,Poc1a disruption causes skeletal dysplasia.,source,,diseases
26496357,Poc1a disruption,lead to,Cilia formation,Mutant fibroblasts have impaired cilia formation.,source,,functions
26496357,Poc1a disruption,lead to,Spermatogenesis,Male infertility is caused by defective spermatogenesis.,source,,functions
26496357,Poc1a disruption,lead to,Cell division,Chondrocytes fail to re-align after cell division.,source,,functions
26496357,Poc1a disruption,lead to,Apoptosis,Chondrocytes undergo increased apoptosis.,source,,functions
26734601,LINE-1,disrupt,Gene,LINE-1 insertion can disrupt the coding sequence of endogenous genes.,target,transposons,
26763876,LINE-1 insertion in RB1,cause,Retinoblastoma,Familial retinoblastoma due to intronic LINE-1 insertion in RB1.,source,,diseases
26763876,LINE-1 insertion in RB1,lead to,Aberrant and noncanonical mRNA splicing,"The insertion caused a highly heterogeneous splicing pattern of RB1 mRNA, including noncanonical acceptor splice sites.",source,,functions
26763876,LINE-1 insertion in RB1,affect,RB1 mRNA,The insertion causes aberrant and noncanonical splicing of RB1 mRNA.,source,,rnas
26901440,LINE-1 retrotransposition,lead to,somatic mutation,LINE-1 retrotransposition causes somatic mutations.,source,,functions
26907772,LINE-1 insertion,lead to,genetic instability,The insertion of LINE-1 is able to cause genetic instability.,source,,functions
26907772,LINE-1 insertion,affect,genetic instability,The insertion of LINE-1 is able to cause genetic instability.,source,,functions
26769797,SVA insertion in TAF1,associate with,X-linked Dystonia-Parkinsonism,The SVA insertion is specific to XDP patients.,source,,diseases
26769797,SVA insertion in TAF1,affect,TAF1 transcript fragments (exons 32-36),"XDP cells exhibited decreased expression of TAF1 transcript fragments from exons 32-36, the region spanning the SVA insertion.",source,,rnas
26769797,SVA insertion in TAF1,affect,N-TAF1,N-TAF1 expression was decreased in XDP patient-specific neural stem cells compared to controls.,source,,proteins
26769797,Decreased N-TAF1 expression,associate with,X-linked Dystonia-Parkinsonism,N-TAF1 showed decreased expression in post-mortem XDP brain and in patient-specific neural stem cells.,source,,diseases
26895060,ORF1p,localize to,subcellular compartments,"Immunofluorescence detects the subcellular localization of ORF1p, a retrotransposition intermediate.",target,proteins,
26895060,ORF2p,localize to,subcellular compartments,"Immunofluorescence detects the subcellular localization of ORF2p, a retrotransposition intermediate.",target,proteins,
26895060,LINE-1 mRNA,localize to,subcellular compartments,"In situ hybridization detects the subcellular localization of LINE-1 mRNA, a retrotransposition intermediate.",target,rnas,
27131603,LINE-1 reduction,associate with,AKT signaling,The reduction of LINE-1 is associated with an activation of AKT signaling.,source,,functions
27197217,LINE-1 insertion in APC,lead to,Two-hit tumorigenesis pathway,The LINE-1 insertion worked with a point mutation in the second APC allele to initiate tumorigenesis through the classic two-hit pathway.,source,,functions
27319353,LINE-1,promote,Genome instability,LINE-1 mobilization is a source of genetic instability in esophageal cancer.,target,transposons,
27482511,SAMHD1 S33A mutation,affect,SAMHD1,The S33A single nucleotide polymorphism abolishes SAMHD1's ability to inhibit LINE-1.,source,,proteins
27482511,SAMHD1 S33A mutation,affect,LINE-1 retrotransposition,The S33A mutation causes SAMHD1 to lose the ability to inhibit LINE-1 retrotransposition.,source,,functions
27482511,SAMHD1 phosphorylation at S33,modify,SAMHD1,SAMHD1 residue S33 is phosphorylated in human cells.,source,,proteins
27482511,SAMHD1 phosphorylation at S33,lead to,LINE-1 retrotransposition inhibition,SAMHD1 requires phosphorylation at position 33 to inhibit LINE-1 retrotransposition.,"source,target",,
27863519,TET enzymes,drive,Retrotransposition control,TET enzymes are implicated in retrotransposition control.,source,,functions
27863519,TET enzymes,participate in,Exaptation,TET enzymes are implicated in exaptation processes of TEs.,source,,functions
27863519,TET enzymes,bind,LINE-1,"TETs are enriched at the 5' UTR of full-length, evolutionarily young LINE-1 elements.",source,,transposons
27428429,SLX4 deficiency,lead to,retrotransposition,Absence of SLX4 leads to upregulated LINE-1 retrotransposition.,source,,functions
27428429,SLX4 deficiency,cause,cytoplasmic DNA accumulation,"Absence of SLX4 caused cytoplasmic DNA accumulation, including LINE-1 sequences.","source,target",,
27428429,FANCD2 deficiency,lead to,retrotransposition,"Similar to SLX4, absence of FANCD2 leads to upregulated LINE-1 retrotransposition.",source,,functions
27293999,LINE-1,damages,host DNA,"LINE-1 damages host DNA via mutational insertions, chromosomal rearrangements, and reprogramming of gene expression.",target,transposons,
27293999,TGF-β1 signaling,mediate,LINE-1 reactivation,Reactivation of LINE-1 by BaP is effected through the canonical TGF-β1 signaling pathway.,target,functions,
27428332,A3DE,localize to,Cytoplasm,A3DE co-localizes with ORF1p in cytoplasm.,target,proteins,
27893851,piRNA/Piwi-proteins,involve in,Rheumatoid arthritis,The induction of piRNA/Piwi-proteins by innate immune stimulators suggests a role in inflammatory processes of rheumatoid arthritis.,source,,diseases
2834650,LINE-1 insertion in c-myc,associate with,ductal adenocarcinoma of the breast,A tumour-specific rearrangement of one c-myc locus containing a LINE-1 insertion was found in a breast carcinoma.,source,,diseases
27900318,LINE-1 ORF2p,mediate,Templated Sequence Insertion Polymorphism (TSIP) formation,Class 1 TSIPs show features of insertions mediated via the LINE-1 ORF2p.,target,proteins,
27900318,DNA double-strand break repair,involve in,Templated Sequence Insertion Polymorphism (TSIP) formation,Class 2 TSIPs show features consistent with repair of a DNA double-strand break via insertion of a DNA patch.,target,functions,
27900318,Templated Sequence Insertion Polymorphism (TSIP),associate with,Generation of human diversity,"Similar to other forms of human polymorphism, TSIPs may be important for the generation of human diversity.",source,,functions
27900318,Templated Sequence Insertion Polymorphism (TSIP),associate with,Genetic disease,"Similar to other forms of human polymorphism, TSIPs may be important for genetic diseases.",source,,diseases
28536242,TDRD9 mutation,cause,Non-obstructive azoospermia,A recessive deleterious mutation in TDRD9 causes non-obstructive azoospermia.,source,,diseases
28536242,TDRD9 mutation,lead to,Maintaining DNA stability in the male germ line,The mutation underscores the importance of maintaining DNA stability in the human male germ line.,source,,functions
28546999,intragenic deletion in COL4A5,cause,Alport syndrome,An in-frame deletion in COL4A5 is associated with Alport syndrome.,source,,diseases
28546999,intragenic deletion in COL4A5,lead to,bipartite exon activation,The deletion activated a new bipartite exon from introns 37 and 41.,source,,functions
28546999,intragenic deletion in COL4A5,affect,COL4A5 mRNA,The deletion shortened the COL4A5 mRNA and introduced a stop codon.,source,,rnas
28238795,CAG repeat expansion in HTT,cause,Huntington disease,HD is caused by a CAG repeat expansion in HTT.,source,,diseases
28238795,Huntington disease,associate with,impaired neural rosette formation,Phenotypic abnormalities in HD hiPSC-derived neural cells included impaired neural rosette formation.,target,diseases,
28238795,Huntington disease,associate with,deficits in mitochondrial respiration,Phenotypic abnormalities in HD hiPSC-derived neural cells included deficits in mitochondrial respiration.,target,diseases,
28586350,Loss of LINE-1/ESCRT interaction,lead to,loss of retrotransposition,Loss of the LINE-1/ESCRT interaction leads to loss of retrotransposition.,"source,target",,
28586350,Loss of LINE-1/ESCRT interaction,affect,endonuclease activity,Loss of the LINE-1/ESCRT interaction leads to reduced LINE-1 endonuclease activity in the nucleus.,source,,functions
28585566,LINE-1 insertion in ERI3,associate with,Schizophrenia,An LINE-1 within ERI1 exoribonuclease family member 3 (ERI3) was found to associate with schizophrenia.,source,,diseases
28516305,LINE-1 methylation,associate with,Arsenic toxicity,LINE-1 methylation is discussed as a potential epigenetic signature for arsenic toxicity.,"source,target",,
28516305,Arsenic toxicity,associate with,Epimutagenic events,Toxic exposure (arsenic) can lead to epimutagenic events.,source,,functions
28930601,LINE-1 down-regulation,affect,epithelial mesenchymal transition,Down-regulation of LINE-1 substantially affects epithelial mesenchymal transition.,source,,functions
28930601,LINE-1 down-regulation,affect,malignancy,Down-regulation of LINE-1 substantially affects growth of malignant cells.,source,,diseases
28381173,Mesothelin-targeting chimeric antigen receptor-modified T cells,suppress,Bile duct carcinoma,Mesothelin-targeting chimeric antigen receptor-modified T cells suppress the growth of bile duct carcinoma.,source,,diseases
28381173,Mesothelin-targeting chimeric antigen receptor-modified T cells,perform,Cytotoxicity,Mesothelin-targeting chimeric antigen receptor-modified T cells exerted cytotoxicity toward mesothelin-expressing cells.,source,,functions
28381173,Mesothelin-targeting chimeric antigen receptor-modified T cells,perform,Cytokine secretion,Mesothelin-targeting chimeric antigen receptor-modified T cells secreted cytokines at higher levels when co-cultured with mesothelin-positive cells.,source,,functions
28381173,Mesothelin-targeting chimeric antigen receptor-modified T cells,perform,Proliferation,Mesothelin-targeting chimeric antigen receptor-modified T cells showed greater proliferative capability than control T cells within xenografts.,source,,functions
28381173,Mesothelin-targeting chimeric antigen receptor-modified T cells,express,Chimeric antigen receptor,Mesothelin-targeting chimeric antigen receptor was expressed by the modified T cells.,source,,proteins
28381173,Mesothelin-targeting chimeric antigen receptor-modified T cells,express,CD107α,Mesothelin-targeting chimeric antigen receptor-modified T cells showed greater expression of CD107α than control T cells.,source,,proteins
28381173,Mesothelin-targeting chimeric antigen receptor-modified T cells,express,CD27,Mesothelin-targeting chimeric antigen receptor-modified T cells showed greater expression of CD27 than control T cells.,source,,proteins
28381173,Mesothelin-targeting chimeric antigen receptor-modified T cells,express,CD137,Mesothelin-targeting chimeric antigen receptor-modified T cells showed greater expression of CD137 than control T cells.,source,,proteins
28381173,Mesothelin-targeting chimeric antigen receptor-modified T cells,express,CD28,Mesothelin-targeting chimeric antigen receptor-modified T cells showed greater expression of CD28 than control T cells.,source,,proteins
28381173,Mesothelin-targeting chimeric antigen receptor-modified T cells,express,CD134,Mesothelin-targeting chimeric antigen receptor-modified T cells showed greater expression of CD134 than control T cells.,source,,proteins
28381173,Mesothelin-targeting chimeric antigen receptor-modified T cells,express,Interferon γ,Mesothelin-targeting chimeric antigen receptor-modified T cells secreted higher levels of interferon γ than control T cells.,source,,proteins
28381173,Mesothelin-targeting chimeric antigen receptor-modified T cells,express,Tumor necrosis factor α,Mesothelin-targeting chimeric antigen receptor-modified T cells secreted higher levels of tumor necrosis factor α than control T cells.,source,,proteins
28381173,Mesothelin-targeting chimeric antigen receptor-modified T cells,express,Interleukin 2,Mesothelin-targeting chimeric antigen receptor-modified T cells secreted higher levels of interleukin 2 than control T cells.,source,,proteins
28381173,Mesothelin-targeting chimeric antigen receptor-modified T cells,express,Interleukin 6,Mesothelin-targeting chimeric antigen receptor-modified T cells secreted higher levels of interleukin 6 than control T cells.,source,,proteins
29201157,ORF1p,bind,RNA,ORF1p is an RNA-binding protein.,target,proteins,
