pmid,source,relation,target,description,missing,source_bucket,target_bucket
6096208,Alu insertion in c-mos,disrupt,c-mos,"The Alu insertions, along with termination codons, contribute to the pseudogenization of c-mos.",source,,genes
6323978,Alu,insert into,ORA-gp5 locus,Alu-type repeats integrated into the ORA-gp5 locus.,target,transposons,
6323978,Alu,inhibit,ORA-gp5 locus,Integration of Alu-type repeats inactivated the potentially oncogenic ORA-gp5 structure.,target,transposons,
6323978,ORA-gp5 locus,associate with,c-mos,The ORA-gp5 locus contains sequences related to the c-mos oncogene.,source,,genes
6323978,ORA-gp5 locus,involve in,Integration,The ORA-gp5 locus structure resulted from retroviral integration.,source,,functions
6323978,ORA-gp5 locus,involve in,Recombination,The ORA-gp5 locus structure resulted from subsequent recombination events.,source,,functions
6323978,ORA-gp5 locus,involve in,Transposition,The ORA-gp5 locus structure resulted from transposition events.,source,,functions
2559294,Alu,insert into,human ribosomal DNA spacer,Four Alus inserted independently into the human rDNA spacer.,target,transposons,
2463956,Alu,insert into,T+ processed pseudogene,An Alu is present in the 3'-untranslated region of the T+ processed pseudogene.,target,transposons,
2497061,LINE-1 insertion in F8,associate with,Hemophilia A,"The LINE-1 insertion was found in a pedigree containing a hemophilia A patient, but was not the causative mutation.",source,,diseases
2839298,Alu insertion in Ecogpt,lead to,Insertional mutagenesis,The insertion of the Alu inactivated the gpt gene.,source,,functions
2566545,Alu insertion in INSR,associate with,Non-insulin-dependent diabetes mellitus,The RFLP caused by the Alu insertion was initially reported to be associated with NIDDM.,source,,diseases
2566545,Alu insertion in INSR,associate with,Hyperinsulinemia,The RFLP caused by the Alu insertion was initially reported to be associated with hyperinsulinemia.,source,,diseases
2566545,Alu insertion in INSR,segregate with,Maturity-onset diabetes of the young,The RFLP caused by the Alu insertion segregated with diabetes in pedigrees with MODY.,source,,diseases
2831458,LINE-1 insertion in Factor VIII gene,cause,Haemophilia A,LINE-1 insertions into the factor VIII gene cause haemophilia A.,source,,diseases
3009826,Alu,insert into,human alphoid repetitive DNA,An Alu has been inserted into the human alphoid repetitive DNA.,target,transposons,
3001638,Alu insertion in Mlvi-2,associate with,B cell lymphoma,The Alu insertion was found in a sample from a B cell lymphoma.,source,,diseases
3001638,Alu insertion in Mlvi-2,lead to,Insertional mutation,"The insertion created an 8 bp direct repeat flanking the Alu, duplicating a single-copy sequence at the insertion site.",source,,functions
7963508,ACE gene polymorphism,affect,Plasma renin activity response to salt restriction,The response of plasma renin activity to salt restriction was greater in patients with the DD genotype.,source,,functions
7920631,LINE-1 insertion in Dystrophin,associate with,Muscular dystrophy,The LINE-1 insertion was found in the dystrophin gene of a muscular dystrophy patient.,source,,diseases
8114745,RNA polymerase III termination signal,inhibit,RNA 3' processing,"The pol III termination signal inhibits RNA 3' processing, stabilizing the putative transposition intermediary.",source,,functions
7693554,Undermethylation of LINE-1 5' end,associate with,L1Hs expression,Undermethylation of specific LINE-1 sequences is associated with L1Hs expression.,source,,functions
7693554,Methylation state of LINE-1 5' end,affect,L1Hs expression,The methylation state of the L1Hs 5' end region plays a role in L1Hs expression.,source,,functions
8393987,Alu retroposition event,associate with,Huntington disease,An Alu retroposition event was detected in two families with Huntington disease.,source,,diseases
8393987,Alu retroposition event,involve in,Insertional mutation,The detected Alu retroposition event in Huntington disease families represents an insertional mutation.,source,,functions
8385341,Advanced glycosylation endproducts,induce,DNA transposition,Advanced glycosylation endproducts induce DNA transposition in mammalian cells.,source,,functions
8385341,Advanced glycosylation endproducts,cause,DNA damage,Advanced glycosylation endproducts react with and cause damage to DNA.,source,,functions
8387534,LINE-1 insertion in Dystrophin,cause,Duchenne muscular dystrophy,The LINE-1 insertion into the dystrophin gene caused Duchenne muscular dystrophy in the patient.,source,,diseases
8387534,LINE-1 insertion in Dystrophin,lead to,Exon skipping,The insertion resulted in skipping of exon 44 during splicing of the dystrophin transcript.,source,,functions
8387534,LINE-1 insertion in Dystrophin,affect,Dystrophin mRNA,The insertion caused the dystrophin transcript to have exon 44 skipped.,source,,rnas
8384324,Alu,insert into,genomic DNA,An Alu insertion was found in genomic DNA from two persons with Huntington's disease.,target,transposons,
8384324,Alu insertion,associate with,Huntington's disease,The Alu insertion showed complete cosegregation with Huntington's disease in two families.,source,,diseases
8384324,alpha-adducin,cooccur with,Alu insertion site,The alpha-adducin gene maps in close proximity to the Alu insertion site.,target,genes,
8384324,12-kilobase transcript,cooccur with,Alu insertion site,A gene encoding a 12-kilobase transcript maps in close proximity to the Alu insertion site.,target,rnas,
8381389,Alu insertion,inhibit,transcription,"The Alu insertion results in a disabled promoter, indicating it inhibits transcription.",source,,functions
8381389,abnormal signal sequence in Tcrb-V6.10,inhibit,recombination,The abnormal recombinase signal sequence precludes V(D)J recombination.,source,,functions
8381385,Alu-Alu recombination,create,duplication in HPRT1 gene,Recombination between Alu sequences created a partial gene duplication.,"source,target",,
8381385,duplication in HPRT1 gene,cause,Lesch-Nyhan syndrome,The duplication in the hprt gene was found in a patient with Lesch-Nyhan syndrome.,source,,diseases
1279394,insertional mutation,lead to,loss of gene product,"Insertional mutations can disrupt a gene, resulting in loss of its product.",target,functions,
1279394,insertional mutation,involve in,recessive mutation,Gene disruption by insertion is expected to be associated with recessive mutations.,target,functions,
1279394,promoter/enhancer activity,affect,neighboring genes,Promoter/enhancer activity from integrated retroposons can influence nearby genes over long distances.,target,functions,
1320255,mutation at site A,affect,LINE-1 transcription,Mutation at the site A binding element caused almost complete loss of LINE-1 promoter activity.,source,,functions
1662412,LINE-1 insertion in F8,cause,Hemophilia A,De novo LINE-1 insertions into the factor VIII gene produced hemophilia A.,source,,diseases
1548934,p53 gene deletion,cause,Acute phase,"In six patients/cell LINE, one p53 allele was deleted and the other inactivated, suggesting a role in disease progression.",source,,diseases
1548934,p53 point mutation,cause,Acute phase,"In six patients/cell LINE, one p53 allele was deleted and the other inactivated by point mutation, suggesting a role in disease progression.",source,,diseases
1548934,p53 rearrangement,cause,Acute phase,"In six patients/cell LINE, one p53 allele was deleted and the other inactivated by rearrangement, suggesting a role in disease progression.",source,,diseases
1662391,Alu insertion in ChE,cause,Acholinesterasemia,"The Alu insertion inactivated the ChE gene, causing acholinesterasemia.",source,,diseases
1660526,Alu retrotransposition into V beta 6.10 promoter,lead to,gene inactivation,Retrotransposition of Alus into the promoter region may have inactivated the V beta 6.10 gene.,source,,functions
1719426,Alu insertion in NF1,lead to,Exon skipping,The Alu insertion results in deletion of the downstream exon during splicing.,source,,functions
1719426,Alu insertion in NF1,lead to,Frameshift mutation,The exon deletion consequently shifts the reading frame.,source,,functions
1719426,Alu insertion in NF1,cause,Neurofibromatosis type 1,The de novo Alu insertion is an unusual NF1 mutation that results in the disease.,source,,diseases
2158907,nuclear protein interacting with Alus,bind,GGAGGC motif,Protein recognizes the conserved sequence motif GGAGGC within Alus.,target,proteins,
2158485,Alu insertion near HLA-DQA1,associate with,trans-species evolution,The Alu sequence suggests integration during hominoid divergence from Old World monkeys.,source,,functions
2158485,Alu insertion near HLA-DQA1,affect,HLA-DQA1,The insertion of Alu near HLA-DQA1 occurred after the separation from HLA-DQA2.,source,,genes
10208652,Acrodermatitis enteropathica mutation,affect,Cytochrome oxidase subunit II,The mutation is associated with reduced expression of cytochrome oxidase subunit II mRNA.,source,,proteins
10208652,Acrodermatitis enteropathica mutation,affect,LINE-1,The mutation is associated with increased expression of LINE-1 element.,source,,transposons
10229571,HERV sequences,participate in,Evolution of class I genes,HERV sequences may play a role in the evolution of class I genes in the MHC.,source,,functions
10066175,LINE-1,insert into,transcribed genes,L1s insert into transcribed genes.,target,transposons,
9884350,Btk mutation,cause,X-linked agammaglobulinemia,Mutations in the Btk gene result in X-linked agammaglobulinemia.,source,,diseases
9694261,Alu,affect,Gene function,Alu insertions can inactivate genes or alter their function.,target,transposons,
9618170,LINE-1,insert into,Duchenne muscular dystrophy,A unique de novo LINE-1 insertion was identified in the muscle exon 1 of DMD.,target,transposons,
9618170,LINE-1 insertion in DMD,cause,X-linked dilated cardiomyopathy,The LINE-1 insertion in DMD is responsible for XLDCM in some Japanese patients.,source,,diseases
9618170,LINE-1 insertion in DMD,affect,Dystrophin muscle transcript,The LINE-1 insertion affected the transcription or stability of the muscle form of dystrophin transcripts.,source,,rnas
9618170,LINE-1 insertion in DMD,associate with,Dystrophinopathy,XLDCM is a clinical phenotype of dystrophinopathy.,source,,diseases
9618170,Duchenne muscular dystrophy,encode,Dystrophin,DMD encodes dystrophin.,source,,proteins
9618170,Duchenne muscular dystrophy,express,Dystrophin muscle transcript,DMD expresses the muscle form of dystrophin transcripts.,source,,rnas
9618170,Duchenne muscular dystrophy,express,Dystrophin brain transcript,DMD expresses the brain form of dystrophin transcripts.,source,,rnas
9618170,Duchenne muscular dystrophy,express,Dystrophin Purkinje cell transcript,DMD expresses the Purkinje cell form of dystrophin transcripts.,source,,rnas
9559534,HERV-K LTR,regulate,CD4,Regulatory elements in the HERV-K LTR may confer distinct regulatory properties to the CD4 gene.,source,,genes
9361030,Alu insertion in EYA1,cause,Branchio-oto-renal (BOR) syndrome,The Alu insertion is a mutation detected in a patient affected by BOR syndrome.,source,,diseases
9419237,Alu,insert into,peri-B segment,Alus are inserted in the peri-B genomic segment.,target,transposons,
9419237,Alu,insert into,peri-C segment,Alus are inserted in the peri-C genomic segment.,target,transposons,
9419237,LINE-1,insert into,peri-B segment,LINE-1 elements are inserted in the peri-B genomic segment.,target,transposons,
9419237,LINE-1,insert into,peri-C segment,LINE-1 elements are inserted in the peri-C genomic segment.,target,transposons,
9367680,Retrotransposition,create,CFTR exon 9-related sequences,CFTR exon 9 sequences were retrotransposed and co-integrated with LINE-1.,target,functions,
9367680,CFTR exon 9-related sequences,associate with,Sequence amplification,The retrotransposed CFTR exon 9 sequences underwent subsequent amplification.,source,,functions
9403067,LINE-1,insert into,alphoid satellite DNA,LINE-1 elements are inserted at specific sites within human alphoid satellite DNA.,target,transposons,
9332354,AT-2,utilize,transcriptional activation,The artificial transposon AT-2 was utilized to facilitate sequencing of a regulatory region that confers transcriptional activation.,source,,functions
9332354,AT-2,insert into,CETP,The artificial transposon AT-2 was integrated into the 5' regulatory region of the CETP gene.,source,,genes
9332354,AT-2,express,dhfr,The artificial transposon AT-2 contains and expresses the dhfr gene.,source,,genes
9168132,LINE-1,associate with,genetic defects,Several genetic defects caused by LINE-1 transposition have been reported.,target,transposons,
9119397,LINE-1,insert into,Duchenne muscular dystrophy,LINE-1 sequences occur in intron 7 of the DMD gene.,target,transposons,
9119397,Alu,insert into,Duchenne muscular dystrophy,Alu sequences are underrepresented in intron 7 of the DMD gene.,target,transposons,
8945517,LINE-1 EN protein,cleave,DNA,"Purified LINE-1 EN protein (LINE-1 ENp) makes 5'-PO4, 3'-OH nicks in supercoiled plasmids.",target,proteins,
8670227,LINE-1 transcripts,localize to,cytoplasm,LINE-1 transcripts were located primarily in the cytoplasm.,target,rnas,
8640237,Alu insertion in BRCA2,cause,Hereditary breast cancer,A germline Alu insertion in BRCA2 was found in a patient with breast cancer.,source,,diseases
8640237,Alu insertion in BRCA2,lead to,Alternative splicing,The Alu insertion in exon 22 resulted in alternative splicing that skipped that exon.,source,,functions
8640237,BRCA2 mutation,associate with,Breast cancer,BRCA2 mutations (germline and somatic) are associated with breast cancer.,source,,diseases
8640237,BRCA1 mutation,associate with,Breast cancer,BRCA1 germline mutations are linked to hereditary breast cancer susceptibility.,source,,diseases
8640237,P53 mutation,associate with,Breast cancer,P53 germline mutations are linked to hereditary breast cancer susceptibility.,source,,diseases
8640237,ATM mutation,associate with,Breast cancer,ATM germline mutations are linked to hereditary breast cancer susceptibility.,source,,diseases
8776588,CMT1A-REP repeat,mediate,meiotic unequal crossover,The CMT1A-REP repeat is proposed to mediate misalignment and meiotic unequal crossover.,source,,functions
8776588,CMT1A-REP repeat,associate with,recombinational hotspot,Breakpoint mapping provides evidence for a recombinational hotspot within the CMT1A-REP repeat.,source,,functions
7769618,LINE-1,cooccur with,LSau,LSau repeats were found in a genomic sector characterized by the simultaneous presence of LINE-1 repeats.,target,transposons,
7549935,human liver-type phosphofructokinase gene promoter,drive,non regulated expression,The proximal promoter region of the human liver-type phosphofructokinase gene drives a non-regulated expression of a reporter gene.,source,,functions
15507602,URE,participate in,Tissue-specific enhancer activity,The upstream regulatory element acts as a tissue-specific enhancer.,source,,functions
15507602,AP-2,bind,TSE,Putative AP-2 binding site is an essential constituent of the trophoblast-specific enhancer.,target,genes,
15507602,Sp-1,bind,TSE,Putative Sp-1 binding site is an essential constituent of the trophoblast-specific enhancer.,target,genes,
15507602,GCMa,bind,TSE,Putative GCMa binding site is an essential constituent of the trophoblast-specific enhancer.,target,genes,
15461819,Alu,involve in,various diseases,Alus have been involved in various diseases through retrotransposition and recombination.,target,transposons,
15109395,LINE-1,express,RNA,LINE-1 expression levels are elevated in malignant ovarian tissues.,target,transposons,
15109395,HERV-W,express,RNA,HERV-W expression levels are elevated in malignant ovarian tissues.,target,transposons,
15028673,LINE-1 ORF1p,localize to,cytoplasm,ORF1p localizes to the cytoplasm.,target,proteins,
15028673,LINE-1 ORF2p,localize to,cytoplasm,Full-length ORF2p localizes predominantly to the cytoplasm.,target,proteins,
15028673,LINE-1 ORF2p,localize to,nucleolus,Carboxy-terminal-deleted ORF2p localizes to the nucleolus.,target,proteins,
14742665,LINE-1 retrotransposition frequency,correlate with,LINE-1 insertion length,More active LINE-1 elements produce longer insertions (>1 kb).,"source,target",,
14742665,Amino acid substitutions in ORF2,affect,LINE-1 retrotransposition frequency,"Substitutions at positions 363, 1220, and 1259 affect frequency.","source,target",,
14742665,Amino acid substitutions in ORF2,affect,LINE-1 insertion length,"Substitutions at positions 363, 1220, and 1259 affect length.","source,target",,
14656960,Alu-mediated genome shuffling,participate in,genome shuffling,Genome shuffling by Alu-mediated rearrangements has contributed to genome architecture during primate evolution.,source,,functions
12884004,Alu Yb9 insertion in Factor VIII,cause,Exon skipping,The intronic Alu Yb9 insertion causes exon skipping.,source,,functions
12884004,Alu retrotransposition event,associate with,Hemophilia A,An Alu retrotransposition event in a coding exon was reported in a family with severe hemophilia A.,source,,diseases
12727900,retrotransposition,create,RPCs,Retroposed copies (RPCs) are derived from mRNA through retrotransposition.,target,functions,
12579417,AluSg,cooccur with,LINE-1,AluSg sequence is adjacent to an LINE-1 element in the Xq25-27.1 region.,target,transposons,
12411507,LINE-1 ORF2p,cleave,DNA,LINE-1 EN activity nicks target DNA for priming reverse transcription.,target,proteins,
12176320,LINE-1,insert into,gene,"LINE-1 retrotransposition can cause exon deletions, implying insertion into genes.",target,transposons,
12094329,LINE-1 insertion in CYBB,cause,Chronic granulomatous disease,The LINE-1 insertion into CYBB caused chronic granulomatous disease in a patient.,source,,diseases
12032244,NFAT,bind,IFNG promoter,NFAT binds to a site within the inserted Alu-associated sequence in the IFNG promoter.,target,proteins,
12032244,NF-kappaB,bind,IFNG promoter,NF-kappaB binds to a site adjacent to the NFAT site within the Alu insertion boundaries.,target,proteins,
11875026,HERV-W,associate with,Disease,HERV-W elements are associated with several human diseases.,target,transposons,
11731496,LINE-1 endonuclease,cleave,DNA,The LINE-1 endonuclease cleaves DNA at its target site to produce a double-strand break.,target,proteins,
11606704,LINE-1 retrotransposition,lead to,insertional mutation,The retrotransposition event is implied to be a mechanism for creating the Sec1 gene.,source,,functions
11591480,stress-induced expression,promote,Alu transcription,Stress induction promotes the transcription of Alus.,target,functions,
11591480,stress-induced expression,promote,LINE-1 RNA co-expression,Some stresses that induce Alu transcription also increase co-expression of LINE-1 RNA.,target,functions,
11479678,Mutations in VEGFR-3,cause,Primary lymphoedema,Mutations in VEGFR-3 have been identified in patients with primary lymphoedema.,source,,diseases
11385709,Alu insertion in F9,cause,Hemophilia B,The Alu insertion in F9 is a germline retrotransposition mutation found in a patient with hemophilia B.,source,,diseases
11385709,LINE-1 insertion in F9,cause,Hemophilia B,The LINE-1 insertion in F9 is a germline retrotransposition mutation found in a patient with hemophilia B.,source,,diseases
11371580,LINE-1 retrotransposition,lead to,genetic damage,Genetic damage is produced by LINE-1 retrotransposition.,target,functions,
11371580,ectopic recombination,lead to,genetic damage,Genetic damage is produced by ectopic recombination between LINE-1 elements.,target,functions,
11371580,genetic damage,associate with,purifying selection,Genetic damage from LINE-1 activity provides the basis for negative selection.,source,,functions
11385207,Impaired fibrinolytic activity,associate with,Atherothrombotic stroke,Impaired fibrinolytic activity has been associated with atherothrombotic disorders.,source,,diseases
11385207,PAI-1 4G/4G genotype,increase risk,Atherothrombotic stroke,The 4G/4G genotype of the PAI-1 gene is significantly associated with an increased risk of atherothrombotic stroke.,source,,diseases
11161810,HAL1,involve in,origin of NSPB1,"HAL1 retrotransposon sequences are present in NSBP1, suggesting involvement in its origin.",target,transposons,
11161810,L1MB7,involve in,origin of NSPB1,"L1MB7 retrotransposon sequences are present in NSBP1, suggesting involvement in its origin.",target,transposons,
11161810,alternate poly(A) site selection,mediate,mRNA stability,Alternate poly(A) site selection may mediate the mRNA stability of the NSBP1 gene.,target,functions,
11161810,NSBP1 gene,encode,NSBP1 mRNA,The NSBP1 gene encodes NSBP1 mRNA transcripts.,source,,rnas
11161810,NSBP1 gene,encode,NSBP1 protein,The NSBP1 gene encodes the NSBP1 protein.,"source,target",,
11161810,HMG-14 gene,encode,HMG-14 protein,The HMG-14 gene encodes the HMG-14 protein.,"source,target",,
11161810,HMG-17 gene,encode,HMG-17 protein,The HMG-17 gene encodes the HMG-17 protein.,"source,target",,
11161810,NSBP1 gene,express,NSBP1 mRNA,The NSBP1 gene expresses three NSBP1 mRNA transcripts.,source,,rnas
11161810,NSBP1 gene,express,NSBP1 protein,The NSBP1 gene expresses the NSBP1 protein.,"source,target",,
11007163,LINE-1 hypomethylation,lead to,Genome instability,Hypomethylation of LINE-1 elements could lead to increased incidence of retrotransposition and resultant genome instability in HCCs.,source,,functions
11007163,LINE-1 hypomethylation,promote,Retrotransposition,Hypomethylation of LINE-1 elements could lead to increased incidence of retrotransposition.,source,,functions
10862620,RHAG 5'-flanking sequence,associate with,Retroviral transposition,The 5'-flanking sequence of the RHAG gene is a preferable target for retroviral transposition.,source,,functions
10862620,GATA-1,bind,GATA motifs,GATA-1 binds to GATA motifs within the RHAG enhancer.,target,proteins,
10862620,GATA motifs,regulate,RHAG,"GATA motifs, particularly the proximal one, are critical for the enhancer activity driving RHAG expression.",source,,genes
10862620,RHAG enhancer,associate with,Erythroid dominant expression,The enhancer inserted into the RHAG locus resulted in the acquisition of erythroid dominant expression.,source,,functions
10781834,Alu/LINE-1 repeat dating,associate with,gene duplication,Alu/LINE-1 repeat dating established that duplications occurred after rodent-primate separation.,source,,functions
20028844,Insertion of snaR-G element,participate in,Hormone gene evolution,Insertion of the element containing snaR-G generated new hormone genes in African Great Apes.,source,,functions
19823873,Transposable elements (TEs),participate in,Cryptic exon activation,TEs contribute to cryptic exon activation in genetic disease.,source,,functions
19776130,APOBEC3G,bind,RNA,The APOBEC3G protein binds RNA via its N-terminal domain.,target,proteins,
19657334,LINE-1 retrotransposition,associate with,somatic mosaicism,De novo LINE-1 retrotransposition events may contribute to individual somatic mosaicism.,source,,functions
19635844,SVA,drive,genome evolution,SVAs drive genome evolution.,target,transposons,
19635844,SVA,affect,transcription,SVA may influence transcription through various mechanisms.,target,transposons,
19635844,SVA,disrupt,gene transcription,An intronic SVA may alter normal gene transcription.,target,transposons,
19471016,genetic reprogramming,lead to,induced pluripotent stem cells,Genetic reprogramming generates induced pluripotent stem cells.,target,functions,
19439515,Alu,insert into,Gene,New Alu insertions occurred in exons of three human genes.,target,transposons,
19439515,Mobile element insertion,lead to,Insertional mutation,Mobile element insertions in genic regions can cause insertional mutations.,source,,functions
19439515,Mobile element-associated events,create,Structural variation,Mobile elements create structural variation in the human genome.,"source,target",,
19439515,Mobile elements,associate with,Structural variation generation,Mobile elements play an important role in generating structural variation.,source,,functions
19407656,progesterone,regulate,HERV-W env,Progesterone significantly upregulated HERV-W env expression.,source,,genes
19393186,LTR7B and AluSx integration,participate in,Exonization,Integration of LTR7B and AluSx caused exonization events in New World monkeys and prosimians.,source,,functions
19393186,LTR7B and AluSx integration,participate in,Alternative splicing,Integration of LTR7B and AluSx caused alternative splicing events in humans.,source,,functions
19324900,MIR,express,RNA,MIR-derived exons are expressed and spliced into mRNAs.,target,transposons,
19324900,Alu,express,RNA,Alu-derived exons are expressed and spliced into mRNAs.,target,transposons,
19266026,Alu retrotransposition,lead to,IRGM pseudogenization,Alu retrotransposition caused the IRGM gene to become a pseudogene.,target,functions,
19266026,ERV insertion,associate with,IRGM resurrection,ERV insertion occurred in conjunction with the reestablishment of the IRGM ORF.,"source,target",,
19209240,duplicative transposition,lead to,genome destruction,Too high rates of duplicative transposition would destroy the genome.,target,functions,
19147684,LINE-1,express,RNA,LINE-1 retrotransposon RNA is expressed in human oocytes.,target,transposons,
19147684,SVA,express,RNA,SVA RNA is expressed in human oocytes.,target,transposons,
18952144,SVA,insert into,DYT3 locus,A disease-specific SVA insertion was identified in the DYT3 proband.,target,transposons,
18952144,SVA insertion,associate with,X-linked Dystonia-Parkinsonism,The SVA insertion is associated with the DYT3 haplotype and disease.,source,,diseases
18951971,Alu retrotransposition pathway,associate with,intra-chromosomal translocations,Evidence suggests the alternative Alu integration pathway is associated with intra-chromosomal translocations.,source,,functions
