pmid,source,relation,target,description,missing,source_bucket,target_bucket
23333607,Retroelement insertions,lead to,Cotranscriptional splicing changes,Retroelement insertions in genes cause significant changes in cotranscriptional splicing.,"source,target",,
23322991,MUTYH variant proteins,lead to,Impaired suppressive activity,"MUTYH variants (p.R154H, p.M255V, p.L360P, p.P377L) have severely impaired suppressive activities against 8OHG-induced mutations.",target,proteins,
23322991,MUTYH variant proteins,localize to,Nucleus,All MUTYH variants and wild-type MUTYH are localized in the nucleus.,target,proteins,
23322991,Cumate,induce,MUTYH expression,Cumate treatment induces expression of MUTYH in established cell LINE.,target,pharmaceuticals,
23322991,8-hydroxyguanine,induce,Mutation frequency increase,8OHG in plasmid causes 86-fold increase in mutation frequency in supF gene.,target,toxins,
23322991,Wild-type MUTYH,inhibit,Mutation frequency,Overexpression of wild-type MUTYH significantly reduces mutation frequency in 8OHG-containing plasmid.,target,proteins,
23322991,MUTYH variant proteins,affect,Mutation frequency,Overexpression of MUTYH variants does not significantly reduce mutation frequency compared to empty vector.,target,proteins,
23125228,LINE-1,create,poly(A) microsatellites,LINE-1 insertions are a major source of A-rich microsatellites due to poly(A) tracts at their 3'-end.,target,transposons,
23125228,Alu,create,poly(A) microsatellites,Alu insertions are a major source of A-rich microsatellites due to poly(A) tracts at their 3'-end.,target,transposons,
23125228,poly(A) microsatellites,involve in,Nucleosome positioning,Poly(A) microsatellites are a major intrinsic signal for nucleosome positioning.,source,,functions
23125228,poly(A) microsatellites,lead to,Epigenetic variation,The abundance and variability of poly(A) microsatellites make them a significant source of epigenetic variation.,source,,functions
23093941,MOV10,localize to,stress granules,MOV10 colocalizes with LINE-1 ORF1p in stress granules.,target,proteins,
23020800,Transposable elements,utilize,Transposition,Transposable elements encode sequences necessary for their own transposition.,source,,functions
23020800,Transposable elements,affect,Transcription termination,"TE sequences provide numerous, cell type-specific termination sites for human gene transcripts.",source,,functions
22926102,MER-derived miRNAs,affect,various target genes,miRNAs derived from transposable elements could widely affect various target genes in the human genome.,"source,target",,
22907758,PAIP2 knockdown,increase,LINE-1 retrotransposition,Knockdown of the PABPC1 inhibitor PAIP2 increased LINE-1 retrotransposition up to 2-fold.,source,,functions
22770213,Defective extrathymic Treg generation,lead to,Fetal resorption,CNS1 (MIR-containing enhancer) deficiency leads to increased fetal resorption in allogeneic pregnancy.,source,,diseases
22745252,LINE-1,insert into,Gene,Somatic LINE-1 insertions tend to occur in genes.,target,transposons,
22745252,LINE-1,disrupt,Gene,Somatic LINE-1 insertions disrupt the expression of the target genes.,target,transposons,
22753232,Increased DCX expression,inhibit,Cell proliferation,Increased DCX expression inhibits proliferation of human neuronal progenitors.,source,,functions
22753232,Increased DCX expression,promote,Cell migration,Increased DCX expression promotes migration of human neuronal progenitors.,source,,functions
22753232,Human embryonic stem cell-derived neuronal progenitors,associate with,Neurodegenerative disease,hNPs provide a potential source for cellular replacement following neurodegenerative diseases.,source,,diseases
22733751,MER20/MER39,involve in,Epistatic capture,The transformation of MER20/MER39 into a strong promoter is described by the mode 'epistatic capture'.,source,,functions
22593550,Attenuated epigenetic repression of transposable elements,associate with,Chromosome rearrangement,Attenuated epigenetic repression of TEs in gibbons may be linked to heavily rearranged chromosomes.,source,,functions
22593550,LAVA elements,involve in,Retrotransposition,LAVA elements have features suggesting they have been retrotransposing in the gibbon genome.,source,,functions
22483866,CSB mutation,cause,Cockayne syndrome,Mutations in the CSB gene most often cause Cockayne syndrome.,source,,diseases
22461402,SVA_F insertion in PMS2,cause,Lynch syndrome,The SVA insertion in PMS2 is a novel mutation type causing Lynch syndrome.,source,,diseases
22214611,SP1,regulate,Gene,SP1 transcription factor binds to genes and regulates their expression.,target,proteins,
22225458,hTERT,express,human telomerase reverse transcriptase,The hTERT gene expresses human telomerase reverse transcriptase.,target,genes,
22225458,Wnt3a,express,Wnt3a protein,The Wnt3a gene expresses the Wnt3a protein.,target,genes,
22225458,human feeder cell LINE,support,self-renewal,Engineered human feeder cell LINE support self-renewal of human iPSCs and ESCs.,source,,functions
22225458,human feeder cell LINE,support,clonal growth,Engineered human feeder cell LINE support clonal growth of human iPSCs and ESCs.,source,,functions
22225458,human feeder cell LINE,support,homologous recombination-mediated gene targeting,Human feeders support homologous recombination-mediated gene targeting in human iPSCs.,source,,functions
22201974,Insertional mutagenesis,associate with,Disease,More than 50 cases of RIPs are associated with disease.,target,functions,
22217707,Mobile genetic elements,utilize,Genetic screening,Mobile elements are used in genetic screening.,source,,functions
22217707,Mobile genetic elements,utilize,Cancer gene therapy,Mobile elements are used in cancer gene therapy.,source,,functions
22185517,ORF2P,bind,DNA,The ORF2P protein encoded by LINE-1 recognizes the sequence motif (TT/AAAA) in the 5'-flanking regions of Alu insertions.,target,proteins,
22159035,ATM deficiency,increase,LINE-1 retrotransposition,Lack or severe reduction of ATM increases LINE-1 retrotransposition efficiency.,source,,functions
22079243,CYP11B1-LINE-1.2 deletion,affect,CYP11B1,Deletion of the LINE-1 element (CYP11B1-LINE-1.2) greatly increases CYP11B1 promoter activity.,source,,genes
22079243,CYP11B1-LINE-1.2 deletion,affect,Alu,Deletion of the LINE-1 element (CYP11B1-LINE-1.2) restores the enhancing effect of Alu on the CYP11B1 promoter.,source,,transposons
22079243,ERRα,interact with,Ad5 site,ERRα is the transcription factor interacting with the Ad5 binding element during basal expression.,target,proteins,
22079243,Ad5 binding element,participate in,basal expression,The Ad5 binding element conserved in the proximal core promoter plays a role in basal expression of both CYP11B genes.,source,,functions
22079243,SF-1 binding element,participate in,basal expression,The SF-1 binding element conserved in the proximal core promoter plays a role in basal expression of both CYP11B genes.,source,,functions
22079243,Ad5 site mutation,affect,promoter activity,Mutation of the Ad5 site reduces promoter activity to the minimal level.,source,,functions
21993621,Glu342Lys mutation,cause,α1-antitrypsin deficiency,The Glu342Lys point mutation in SERPINA1 causes α1-antitrypsin deficiency.,source,,diseases
21987713,A-to-I RNA editing,lead to,nuclear retention of transcripts,dsRNA-mediated A-to-I editing leads to nuclear retention of transcripts.,target,functions,
21987713,A-to-I RNA editing,lead to,change in miRNA target,dsRNA-mediated A-to-I editing leads to a change in miRNA target.,target,functions,
21979053,alpha-dystroglycan,bind,laminin,Properly glycosylated alpha-dystroglycan binds laminin.,target,proteins,
21979053,SVA insertion in fukutin,affect,fukutin mRNA,"The SVA insertion leads to shorter, aberrant fukutin mRNA transcripts.",source,,rnas
21979053,SVA insertion in fukutin,affect,fukutin,The SVA-induced splicing event truncates the fukutin C-terminus and adds SVA-encoded amino acids.,source,,proteins
21979053,SVA insertion in fukutin,lead to,Aberrant mRNA splicing,The SVA insertion provokes an abnormal splicing event via its acceptor site.,source,,functions
21874386,Hypomethylation of AluY promoter,activate,KCNH5,Hypomethylation of the AluY-derived promoter correlates with KCNH5 expression in the placenta.,source,,genes
21874386,Methylation of AluY promoter,silence,KCNH5,Complete methylation of the AluY-derived promoter correlates with silenced KCNH5 transcript in embryonic tissues.,source,,genes
21827582,"7,12-dimethylbenz[a]anthracene",cause,Mutation in Ha-ras,DMBA mutates the Ha-ras gene.,target,toxins,
21827582,Mutation in Ha-ras,associate with,LINE-1 retrotransposition,Nine LINE-1-RTP-positive tumors were positive for activated Ha-ras.,source,,functions
21636526,LINE-1,mediate,SVA retrotransposition,SVAs are mobilized in trans by LINE-1 proteins.,target,transposons,
21636526,LINE-1 ORF1p,involve in,SVA retrotransposition,Data suggest a variable requirement for LINE-1 ORF1p for SVA retrotransposition.,target,proteins,
21636125,dTomato,encode,red fluorescent protein,The dTomato gene encodes a red fluorescent protein.,target,genes,
21636125,mOrange,encode,yellow fluorescent protein,The mOrange gene encodes a yellow fluorescent protein.,target,genes,
21636125,EGFP,encode,enhanced green fluorescent protein,The EGFP gene encodes an enhanced green fluorescent protein.,target,genes,
21423624,LINE-1,disrupt,Gene,Insertion of active full-length LINE-1 sequences into host gene introns disrupts gene expression.,target,transposons,
21370050,Alu retroelement RNA,nucleate,high-molecular-mass APOBEC3G complexes,Alu retroelement RNAs likely nucleate HMM A3G complexes.,target,rnas,
21370050,high-molecular-mass APOBEC3G complexes,sequester,Alu retroelement RNA,HMM A3G complexes sequester Alu retroelement RNAs.,source,,rnas
21370050,high-molecular-mass APOBEC3G complexes,inhibit,Alu retrotransposition,HMM A3G complexes inhibit Alu retrotransposition by sequestering RNAs.,source,,functions
21370050,high-molecular-mass APOBEC3G complexes,suppress,APOBEC3G enzymatic activity,Assembly into HMM complexes suppresses A3G's enzymatic activity.,"source,target",,
21370050,high-molecular-mass APOBEC3G complexes,promote,HIV-1 infection,HMM A3G complex assembly may render cells permissive to HIV-1 infection.,source,,diseases
21287136,Alu RNA modification,lead to,nuclear retention of mRNA,Modification of Alu sequences causes nuclear retention of these mRNAs.,source,,functions
21297615,DICER1 deficit,cause,RPE degeneration,Conditional ablation of Dicer1 induces RPE degeneration in mice.,source,,functions
21297615,DICER1 deficit,lead to,Age-related macular degeneration,DICER1 deficit induces Alu RNA toxicity in age-related macular degeneration.,source,,diseases
21297615,DICER1 knockdown,affect,Alu,DICER1 knockdown induces accumulation of Alu RNA in human RPE cells.,source,,transposons
21209933,OCT4,localize to,cell nucleus,Ectopically expressed OCT4 localized to the cell nucleus.,target,proteins,
21209933,mRNA transfection,activate,OCT4,mRNA transfection increased expression of endogenous OCT4.,source,,proteins
21209933,mRNA transfection,activate,NANOG,mRNA transfection increased expression of endogenous NANOG.,source,,genes
21209933,mRNA transfection,activate,DNMT3β,mRNA transfection increased expression of endogenous DNMT3β.,source,,genes
21209933,mRNA transfection,activate,REX1,mRNA transfection increased expression of endogenous REX1.,source,,genes
21209933,mRNA transfection,activate,SALL4,mRNA transfection increased expression of endogenous SALL4.,source,,genes
20935053,snaR-A,localize to,ribosomes,snaR-A is stably bound to ribosomes in HeLa cells.,target,rnas,
20949108,ORF1p coiled-coil domain mutation,affect,LINE-1 RNP assembly,Mutations in the coiled-coil domain of ORF1p reduce levels of ORF1p and/or ORF2p in LINE-1 RNPs.,source,,functions
20949108,ORF1p RNA recognition motif mutation,affect,LINE-1 RNP assembly,Mutations in the RNA recognition motif of ORF1p reduce levels of ORF1p and/or ORF2p in LINE-1 RNPs.,source,,functions
20949108,ORF2p cysteine-rich domain mutation,affect,LINE-1 RNP assembly,Mutations in the cysteine-rich domain of ORF2p reduce levels of ORF1p and/or ORF2p in LINE-1 RNPs.,source,,functions
20949108,ORF1p,localize to,cytoplasmic foci,ORF1p localizes to cytoplasmic foci often associated with stress granules.,target,proteins,
20949108,ORF2p,localize to,cytoplasmic foci,ORF2p localizes to cytoplasmic foci often associated with stress granules.,target,proteins,
20949108,LINE-1 RNA,localize to,cytoplasmic foci,LINE-1 RNA localizes to cytoplasmic foci often associated with stress granules.,target,rnas,
20846497,piR-49322,localize to,nucleolus,piR-49322 was localized in the nucleolus.,target,rnas,
20846497,piR-49322,localize to,nuclear membrane periphery,piR-49322 was localized around the periphery of nuclear membrane.,target,rnas,
20852066,ARNT1-mediated LINE-1-RTP,participate in,adaptation to environmental changes,A possible role of ARNT1-mediated LINE-1-RTP in the adaptation of living organisms to environmental changes is discussed.,source,,functions
20603005,Altered DNA methylation,lead to,LINE-1 mobilization,Altered DNA methylation may be responsible for high levels of LINE-1 mobilization in tumors.,source,,functions
20500903,CpGcluster,associate with,Alu,CpGcluster predictions show less overlap with Alu retrotransposons compared to sliding-window methods.,source,,transposons
20521842,F460K mutation,affect,Metnase,"The dimerization mutant F460K affects Metnase's DNA cleavage, DNA-binding, and nonhomologous end joining activities.",source,,proteins
20521842,F460K mutation,lead to,DNA cleavage,The dimeric form of the enzyme (affected by F460K) is required for its DNA cleavage activity.,source,,functions
20521842,F460K mutation,lead to,DNA-binding,The dimeric form of the enzyme (affected by F460K) is required for its DNA-binding activity.,source,,functions
20521842,F460K mutation,lead to,nonhomologous end joining,The dimeric form of the enzyme (affected by F460K) is required for its nonhomologous end joining activity.,source,,functions
20176473,Alu RNAs,promote,exonization via alternative splicing,Alu RNAs embedded in Pol II transcripts promote exonization via alternative splicing.,source,,functions
20176473,Alu RNAs,affect,mRNA production control,SINE encoded RNAs impact production of mRNAs.,source,,functions
20147320,LINE-1 RNA,localize to,cytoplasmic foci,LINE-1 RNA localizes to cytoplasmic foci.,target,rnas,
20147320,ORF1p,localize to,cytoplasmic foci,ORF1p localizes to cytoplasmic foci.,target,proteins,
20147320,ORF2p,localize to,cytoplasmic foci,ORF2p localizes to cytoplasmic foci.,target,proteins,
20147320,Alu RNA,localize to,nuclear foci,Alu RNA forms small round foci in nuclei.,target,rnas,
20147320,SVA RNA,localize to,cytoplasm,SVA RNA is cytoplasmic.,target,rnas,
20147320,SVA RNA,localize to,large nuclear aggregates,SVA RNA is concentrated in large nuclear aggregates.,target,rnas,
19740021,transposase,catalyze,piggyBac integration,Transposase mediates piggyBac integration events.,target,proteins,
31851760,F8 mutation,cause,Hemophilia A,Mutations in the F8 gene cause Hemophilia A.,source,,diseases
31822674,Transposable elements (TEs),perform,regulatory function,TEs encompass functional regulatory elements and can be in an active regulatory state.,source,,functions
31822674,Transposable elements (TEs),associate with,gene regulation,"TEs contribute to the human regulatory epigenome, providing a profile of their activity in normal tissue.",source,,functions
31814915,CAR transgene,express,CAR-T cells,CAR transgene is expressed in engineered T cells.,target,genes,
31814915,CAR-T cells,perform,cytotoxicity,CAR-T cells exhibit cytotoxicity against target cells.,source,,functions
31775878,Glial cells,involve in,Central sensitization to pain,Glial cells play a key role in central sensitization to pain.,source,,functions
31775878,Glial cells,involve in,Persistent postoperative pain,Glial cells are involved in the development of persistent pain.,source,,diseases
31717545,MER6,insert into,genes,MER6 insertions were found within genes.,target,transposons,
31666001,MIR and AluSp combination,participate in,Intron removal,The combined MIR and AluSp sequences provide branch point sequences for the intron removal process.,source,,functions
31666001,MIR and AluSp,participate in,Sequence collaboration,Sequential integration and sequence divergence of MIR and AluSp collaborated to generate lineage-specific transcripts.,source,,functions
31666001,MIR and AluSp,express,BLOC1S2 novel transcript,The combined MIR and AluSp sequences provide splice sites and generate Old World monkey-specific transcripts of BLOC1S2.,source,,rnas
31623314,MT_E7,associate with,Differentiation,E7-immortalized cell LINE displayed differentiation potential.,source,,functions
31623314,MT_hTERT,associate with,Differentiation,hTERT-immortalized cell LINE displayed differentiation potential.,source,,functions
31568525,HERV,express,retrotranscriptome,HERV expression contributes to the retrotranscriptome.,target,transposons,
31568525,retrotranscriptome,associate with,cell type identification,The retrotranscriptome has potential to be used for cell type identification.,source,,functions
31377971,AluYa5 insertion in IFN-γR1,cause,Complete autosomal recessive IFN-γR1 deficiency,The AluYa5 insertion underlies complete autosomal recessive IFN-γR1 deficiency.,source,,diseases
31230816,YY1 binding site,mediate,LINE-1 promoter DNA methylation,YY1 binding site mediates LINE-1 promoter DNA methylation.,source,,functions
31230816,YY1 binding site mutation,affect,LINE-1,L1s with mutated YY1 binding sites were hypomethylated and highly mobile.,source,,transposons
31230816,YY1 binding site mutation,lead to,LINE-1 evasion of repression,L1s with mutated YY1 binding sites evade repression and retrotranspose.,source,,functions
31151386,SVA_D,associate with,8-cell and morula specific genes,SVA_D transposons show potential links to nearby 8-cell and morula specific gene expression.,target,transposons,
31151386,LTR5_Hs,associate with,8-cell and morula specific genes,LTR5_Hs transposons show potential links to nearby 8-cell and morula specific gene expression.,target,transposons,
31151386,LTR70,associate with,8-cell and morula specific genes,LTR70 transposons show potential links to nearby 8-cell and morula specific gene expression.,target,transposons,
31151386,SVA_D,express,RNA,SVA_D transposons are highly upregulated at 8-cell and morula stages.,target,transposons,
31151386,LTR5_Hs,express,RNA,LTR5_Hs transposons exhibit expression during early human embryonic development.,target,transposons,
31151386,LTR70,express,RNA,LTR70 transposons exhibit expression during early human embryonic development.,target,transposons,
31151386,DNA methylation,inhibit,Repeat expression regulation,DNA methylation levels negatively correlate with repeat expression at critical stages.,source,,functions
31101683,piggyBac,insert into,genome,piggyBac transposon randomly inserts CRISPR-Cas9 components into mammalian genomes.,target,transposons,
31101683,Hygromycin B,confer,resistance,A gene conferring resistance to Hygromycin B is included in the vector.,target,pharmaceuticals,
31101683,G418,confer,resistance,A gene conferring resistance to G418 is included in the vector.,target,pharmaceuticals,
31073336,LINE-1 insertion in Axin1,cause,kinky tail phenotype,Insertion of a chimeric LINE-1 into Axin1 induced the kinky tail phenotype in mice.,"source,target",,
31073336,LINE-1 insertion in Axin1,affect,Axin1 transcript,"The LINE-1 insertion led to the production of a longer, unique Axin1 transcript isoform.",source,,rnas
30973874,MECP2 mutation,affect,L1Hs,MECP2 mutations alter the genomic patterns of somatic L1Hs insertions in Rett patients.,source,,transposons
30973874,MECP2 mutation,lead to,Rett syndrome,Mutations in MECP2 cause Rett syndrome.,source,,diseases
30926969,Transposable elements,drive,Onco-exaptation,Transposable elements drive widespread expression of oncogenes in human cancers through onco-exaptation.,source,,functions
30764754,SETMAR,express,H3K4me3 modifications,The SETMAR gene presents H3K4me3 modifications as expected for a human housekeeping gene.,target,genes,
30774773,UXT depletion,associate with,Prostate cancer,Loss of UXT expression in primary prostate cancer is associated with high Gleason grade and poor relapse-free survival.,source,,diseases
30774773,UXT depletion,promote,High grade prostatic intraepithelial neoplasia,Prostate-specific Uxt KO mice developed PIN by 4-6 months.,source,,diseases
30774773,UXT depletion,increase risk,Prostate cancer,Loss of UXT is an early event during prostate cancer progression.,source,,diseases
30774773,UXT depletion,lead to,Genome instability,Loss of UXT may contribute to genome instability.,source,,functions
30774773,UXT depletion,increase risk,DNA damage,Cancer cells with UXT depletion have accumulated DNA damage.,source,,functions
30774773,UXT depletion,regulate,LINE-1,"UXT depletion in prostate cancer cells increased retroelements expression, including LINE-1.",source,,transposons
30774773,UXT depletion,regulate,Alu,"UXT depletion in prostate cancer cells increased retroelements expression, including Alu.",source,,transposons
30774773,UXT depletion,promote,Retrotransposition,Cancer cells with UXT depletion have increased retrotransposition activity.,source,,functions
30739781,SAMHD1,localize to,nucleus,SAMHD1 resides in the nucleus.,target,proteins,
30729177,Loss-of-function mutations in ADAR p150,cause,Aicardi-Goutières syndrome,Loss-of-function mutations in ADAR p150 are causal for Aicardi-Goutières Syndrome.,source,,diseases
30729177,Loss-of-function mutations in ADAR p150,affect,Alu dsRNAs,Loss-of-function mutations in ADAR p150 allow persistent activation by Alu dsRNAs.,source,,rnas
30729177,Loss of DICER1 function,lead to,Age-related macular degeneration,Loss of DICER1 function produces age-related macular degeneration.,source,,diseases
30729177,ZBP1,bind,Z-DNA/Z-RNA,ZBP1 binds left-handed Z-DNA/Z-RNA.,target,proteins,
30658985,HIWI2,localize to,nucleus,HIWI2 shows nuclear localization in fetal germ cells.,target,proteins,
30658985,LINE-1-expressing germ cells,activate,repression pathway,LINE-1-expressing germ cells activate the repression pathway.,"source,target",,
30658985,repression pathway,lead to,epigenetic silencing,The repression pathway leads to epigenetic silencing of LINE-1 via H3K9me3.,source,,functions
30658985,HSP90α,express,low levels,The earliest germ cells with high LINE-1-ORF1p express low levels of HSP90α.,target,genes,
30568248,reprogramming,trigger,LINE-1 retrotransposition,Reprogramming triggers endogenous LINE-1 retrotransposition.,target,functions,
30568248,reprogramming,trigger,Alu retrotransposition,Reprogramming triggers endogenous Alu retrotransposition.,target,functions,
30623286,Alu,express,RNA,"Alu was the principal source of transcript from repetitive sequences, measured in RPKM.",target,transposons,
30418605,Alu insertion in CD58,promote,Exon skipping,The Alu insertion promotes skipping of CD58 exon 3.,source,,functions
30418605,Alu insertion in CD58,cause,Multiple sclerosis,The Alu may be the causative variant for increased MS risk at this locus.,source,,diseases
30418605,Alu variant in CD58,associate with,Multiple sclerosis,Reduced CD58 expression is associated with risk for developing multiple sclerosis.,source,,diseases
30418605,Alu variant in CD58,express,frameshifted transcript,The Alu insertion results in a frameshifted transcript.,source,,rnas
30418605,Alu variant in CD58,regulate,CD58,"The Alu variant is a sQTL for CD58, altering its splicing.",source,,genes
30514403,NKG2D.CAR.NK cells,perform,anti-tumor immunity,NKG2D.CAR-engineered NK cells perform anti-tumor immune functions.,source,,functions
30341801,Alu insertion in CHM,cause,Choroideremia,The Alu insertion was established as a disease-causing variant for choroideremia.,source,,diseases
30341801,c.-90C>G variant,affect,CHM transcription,The c.-90C>G promoter substitution suggested a CHM transcription defect.,source,,functions
30341801,c.-108A>G variant,affect,CHM transcription,The c.-108A>G promoter substitution suggested a CHM transcription defect.,source,,functions
30367120,Rad18,localize to,Rad18-nuclear foci,Rad18 sequestered LINE-1 ORF1p into Rad18-nuclear foci.,target,proteins,
30237828,SVA_F,associate with,Human,SVA_F is a human-specific subfamily.,target,transposons,
30221208,cellular environment,affect,retrotransposition,Cellular environment significantly affects retrotransposition efficiency.,source,,functions
30123290,LINE-1,associate with,Disease,LINE-1 retrotransposition can produce genetic diversity or disease.,target,transposons,
30123290,retrotransposition,lead to,Disease,Retrotransposition can produce disease.,target,functions,
30123290,retrotransposons,mediate,epigenetic memory,Retrotransposons may mediate epigenetic memory.,source,,functions
30123290,retrotransposons,participate in,virus defense,Retrotransposons may defend against virus infection.,source,,functions
30123290,retrotransposons,regulate,gene regulation,Retrotransposons are capable of regulating nearby genes.,source,,functions
30123290,retrotransposons,participate in,chromatin assembly,Retrotransposons may orchestrate high-order chromatin assembly.,source,,functions
30123290,retrotransposons,participate in,stem cell status conversion,Understanding retrotransposons may facilitate stem cell status conversion.,source,,functions
30061100,KAP1 depletion,lead to,interferon response,Loss of KAP1 leads to activation of an interferon response.,source,,functions
30061100,KAP1 depletion,lead to,RNA-sensing response,Loss of KAP1 leads to an RNA-sensing response mediated through MAVS signaling.,source,,functions
